sample_type,batch_file,tweet_id,text,images,label,author,post_url,date_posted,topic,error_category,flagging_tweet_text,flagging_tweet_authors
fake_sample,batch2,64,"Breaking: New tanks that were recently in training in Gaza are now heading to the north as part of Division 98, the elite division of the IDF. ",./media/batch2/64/images/img0.jpeg,False,daniel hanukha,https://x.com/israelifihther/status/1837812065131798840,2024-09-22 11:11:55,Politics-Warfare-Israel-Palestine,De-contextualization,"This video is from October 9th, 2023. https://t.co/UGi3hBGpLm",Tal Hagin
fake_sample,batch2,65,Multiple rockets have directly hit military targets in central occupied Palestine. ,./media/batch2/65/images/img0.jpeg,False,SilencedSirs◼️,https://x.com/SilentlySirs/status/1837629616028094745,2024-09-21 23:06:56,Politics-Warfare-Israel-Palestine,De-contextualization,"The funniest part about this disinformation post is that it's so low effort.
The Hebrew caption in the video says: ""This time it's not connected to us. An explosion at a gas station in Aden, Yemen."" https://t.co/vobhEObYEH",Tal Hagin
fake_sample,batch2,66,Zionist footage of Resistance attack on Ramat David base and airport.,./media/batch2/66/images/img0.jpeg,False,vanessa beeley,https://x.com/talhagin/status/1837786842126516312,2024-09-21 20:49:27,Politics-Warfare-Middle-East-Conflict,Misattributed Images,"That's not the Ramat David Air Force base. 

That's a video of a blast at a gas station in Aden, Yemen that took place on August 31st, 2024. https://t.co/HnhjWb4MeS",Tal Hagin
fake_sample,batch2,67,Breaking: The IDF is currently destroying major weapons depots in Southern Lebanon.,./media/batch2/67/images/img0.jpeg,False,Eyal Yakoby,https://x.com/talhagin/status/1837595017638039904,2024-09-21 20:49:27,Politics-Warfare-Lebanon-Israel Conflict,Incorrectly Captioned Images,"This video is not from the current IDF airstrikes in Southern Lebanon. 

The earliest uploads attribute it to being from an airstrike in Tikhoretsk, Russia. 
Also, the audio was manipulated. In the earlier version they aren't speaking Arabic. https://t.co/P0Jdt2og4M",Tal Hagin
fake_sample,batch2,68,Even dead are scared of Israel’s Drones See the Miracle 🤣🤣@netanyahu@LizaRosen0000@Mish_K_@YorksRose_84,./media/batch2/68/images/img0.jpeg,False,Harman Singh Kapoor,https://x.com/kingkapoor72/status/1838176448693043456,,Society,De-contextualization,"I remember this clip. The video was shared in 2020. Users said they were boys in Jordan. The topic was about Covid restrictions.

https://t.co/eZ97PtQRba https://t.co/ySFD651SIb",David Puente
fake_sample,batch2,69,"عاجل⛔️وابل من صورايخ كاتيوشا اطلقها حزب الله على قاعدة عسكرية اسرائيلية…
 ",./media/batch2/69/images/img0.jpeg,False,"Dr.Sam Youssef Ph.D.,M.Sc.,DPT.",https://x.com/drhossamsamy65/status/1822788963980943408,2024-08-12 00:15:29,Politics-Warfare-Lebanon-Israel Conflict,De-contextualization,"This footage isn't from the current Hezbollah strike on northern Israel.

It was uploaded as early as April 14th, 2024. https://t.co/Fmn0y852aM",Tal Hagin
fake_sample,batch2,70,"Punjab Police STF arrested Punjab BJP leader and former Congress MLA Satkar Kaur Gehri in a drug case, as she was caught red-handed with 100 grams of heroin. Gehri was the Congress MLA from Ferozepur Rural during Captain Amarinder Singh’s tenure. She later joined the BJP along ",./media/batch2/70/images/img0.jpeg; ./media/batch2/70/images/img1.jpeg,False,Gagandeep Singh,https://x.com/Gagan4344/status/1849099929186091370,2024-10-23 14:45:52,Politics-other,De-contextualization,"Tweet 1. ANI didn't tweet the police press conference.

Tweet 2 : After getting called out, Later, ANI did tweet but didn't mention the name and the party affiliation when a BJP member was caught in drug case. 
Tweet 3 : Today when BJP expelled the BJP Member, The ANI didn't https://t.co/GitIhhHJ6g",Mohammed Zubair
fake_sample,batch2,71,"#अयोध्या में बुलेट पर सवार साधु के भेष में दो युवकों द्वारा मारपीट की घटना सामने आई है। इन युवकों पर छेड़खानी का आरोप लगाया गया है, जिसका वीडियो सोशल मीडिया पर वायरल हो रहा है @ayodhya_police @Uppolice ",./media/batch2/71/images/img0.jpeg,False,UttarPradesh.ORG News,https://x.com/WeUttarPradesh/status/1849091483632382066,2024-10-23 14:12:18,Society,De-contextualization,"In this video the person beating the Baba while accusing them of molestation, They later accuse him of being a Muslim. There are many such videos of Sadhus/Baba's getting beaten up by accusing them of being Muslims. 🤦🏾‍♂️ https://t.co/QFiA3JtSTw",Mohammed Zubair
fake_sample,batch2,72,"""No Asif don't"" : A viral video from Delhi's Sultanpuri area where a man threatened to stab a lady with big knife in broad day light but didn't because of crowd!
",./media/batch2/72/images/img0.jpeg,False,Megh Updates 🚨™,https://x.com/MeghUpdates/status/1841345993339535639,2024-10-02 05:14:30,Society,De-contextualization,"Fake News by @MeghUpdates 

Fact : An incident from Sultanpuri is being shared with a communal angle while there is no Hindu-Muslim angle in it. Police has arrested 3 accused in this case. Rakesh, Rahul and a minor. All three accused belong to the Hindu community and have been https://t.co/rVBE0aNUVL",Mohammed Zubair
fake_sample,batch2,73,"Asif abused a woman and threatened to stab her in broad daylight in Sultanpuri, Delhi.

",./media/batch2/73/images/img0.jpeg,False,Incognito,https://x.com/Incognito_qfs/status/1841356296651493609,2024-10-02 05:55:26,Society,Misattributed Images,"Fake News by @Incognito_qfs 

Fact : An incident from Sultanpuri is being shared with a communal angle while there is no Hindu-Muslim angle in it. Police has arrested 3 accused in this case. Rakesh, Rahul and a minor. All three accused belong to the Hindu community and have been https://t.co/1ujolrhxif",Mohammed Zubair
fake_sample,batch2,74,"Terror of Jihadis in Sultanpuri, called Mini Pakistan of Delhi. See how Mohammad Asif tried to attack a woman with a big knife.",./media/batch2/74/images/img0.jpeg,False,Frontalforce 🇮🇳,https://x.com/zoo_bear/status/1848443775397597307/photo/1,2024-10-02 14:39:00,Society,Incorrectly Captioned Images,"Fake News by @FrontalForce 

Fact : An incident from Sultanpuri is being shared with a communal angle while there is no Hindu-Muslim angle in it. Police has arrested 3 accused in this case. Rakesh, Rahul and a minor. All three accused belong to the Hindu community and have been https://t.co/rM2WUMHNtL",Mohammed Zubair
fake_sample,batch2,75,"""Leave it Asif"" - say the friends of a youth in Delhi's Sultanpuri area, after he pulls out a big dagger &amp; makes stabbing motions at a Hindu woman he is arguing with.

In 2022, Hiralal Gujarati was murdered in the same Sultanpuri by Irfan Siddiqui.

",./media/batch2/75/images/img0.jpeg,False,HinduPost,https://x.com/hindupost/status/1841361018385060075,2024-10-02 06:14:12,Society,De-contextualization,"Fact : An incident from Sultanpuri is being shared with a communal angle while there is no Hindu-Muslim angle in it. Police has arrested 3 accused in this case. Rakesh, Rahul and a minor. All three accused belong to the Hindu community and have been arrested. 
Alt News fact",Mohammed Zubair
fake_sample,batch2,76,"Under Sharia law, if a woman is raped, it’s considered sex outside of marriage, and she is to be punished.In most Sharia countries, women are stoned to death if they report they were raped. So the one in the video got ‘lucky’ for only being flogged.",./media/batch2/76/images/img0.jpeg,False,Dr. Maalouf,https://x.com/zoo_bear/status/1848355986471551360/photo/1,2024-10-21 01:55:00,Society,Incorrectly Captioned Images,"Fake News by @realMaalouf. 
Fact : Alt News found that the incident had taken place in Bulandshahr, Uttar Pradesh in March 2018. According to news reports, the woman seen in the video was beaten up by her husband Shaudan Singh for allegedly having eloped with another man. 
Police https://t.co/bXbLaAE6jc",Mohammed Zubair
fake_sample,batch2,77,"Unbelievable! Trump looks completely disinterested in being close to Netanyahu. 

Watching Netanyahu’s face when he starts to walk away is a treat. 

I believe Trump will play the international peacemaker again if he gets in to power. That is, if he’s not taken out beforehand. ",./media/batch2/77/images/img0.jpeg,False,Johnny Vedmore,https://x.com/JohnnyVedmore/status/1816813551069110537,2024-07-26 12:31:19,Politics-Warfare-Israel-Palestine,De-contextualization,"This footage isn't recent, it's from May 22nd, 2017. https://t.co/gJ46qZlkmd",Tal Hagin
fake_sample,batch2,78,"Don't Look Away | Footage from an Israeli detention camp near the Gaza border has been released shows evidence of men, women, and children being tortured.",./media/batch2/78/images/img0.jpeg,False,TIMES OF GAZA,https://x.com/talhagin/status/1806345694204109270,2024-06-27 10:15:46,Politics-Warfare-Middle-East-Conflict,Misattributed Images,"This the Bir al-Ghanam Camp, but it's not located in Gaza or Israel - But Libya. 
According to this report, it houses Egyptian Syrian immigrants. https://t.co/eF5ydip9Tg",Tal Hagin
fake_sample,batch2,79,"🇮🇱🇱🇧 | AHORA: El ejército israelí avanza hacia el norte hacia el Líbano, el paso de los vehículos militares se está produciendo durante más de 48 horas continuas en una aparente nueva escalada de tensiones entre ambos países.
 ",./media/batch2/79/images/img0.jpeg,False,Alerta News 24,https://x.com/AlertaNews24/status/1805256180014440825,2024-06-24 15:06:28,Politics-Warfare-Lebanon-Israel Conflict,De-contextualization,"This isn't ""Now"".

This footage has been used multiple times over the past few months. Example of one earliest uses of it was on February 29th, 2024: https://t.co/aoZQC11cGf",Tal Hagin
fake_sample,batch2,80,Footage of the #Israeli attack on #Iran,./media/batch2/80/images/img0.jpeg,False,Salwan Momika,https://x.com/Shayan86/status/1849970704608903249/photo/1,2024-10-26 00:37:00,Politics-Warfare-Israel-Palestine,Incorrectly Captioned Images,"This video falsely claims to show the impact of Israeli strikes on Iran tonight.

This video is in fact from 1 October, showing Iranian missile strikes near an air base in Israel. https://t.co/O11QvfV4vZ",Shayan Sardarizadeh
fake_sample,batch2,81,"A Palestinian child trapped under the rubble awaits help.
What a heartbreaking scene.

 ",./media/batch2/81/images/img0.jpeg,False,Huma Zehra,https://x.com/HumaZhr/status/1850244747824439561,2024-10-26 18:34:58,Politics-Warfare-Israel-Palestine,De-contextualization,"This viral video, viewed 2.7 million times, claims to show a ""child trapped under the rubble"" in Gaza.

But the clip isn't related to Gaza. It shows a little girl looking through a hole in a wall, as part of a series of videos of the same little girl posted by a TikTok account. https://t.co/Nuz7apoeVJ",Shayan Sardarizadeh
fake_sample,batch2,82,"🚨🚨🚨This happened in Whitfield County in my district - GA-14.

We vote on Dominion voting machines then it prints a paper ballot with our selections made on the machines.

This voter’s printed ballot had been changed from their selections made on the machine.

Good thing they ",./media/batch2/82/images/img0.jpeg,False,Marjorie Taylor Greene 🇺🇸,https://x.com/mtgreenee/status/1847335767728689240,2024-10-18 17:55:43,Politics-United-States-Presidential-Election,De-contextualization,"Marjorie Taylor Greene falsely claimed a Georgia county's machines had flipped Trump votes to Harris after a voter realized their printed ballot had the wrong choice marked on a question.

Officials said it was user error, and the voter cast a new ballot.

https://t.co/GpN5eirFw5 https://t.co/fvt3oNafF6",Bill McCarthy
fake_sample,batch2,83,🔥🚨BREAKING NEWS: Hurricane Milton is now a Category 5 Hurricane and is expected to do severe damage to Florida.,./media/batch2/83/images/img0.jpeg,False,Dom Lucre | Breaker of Narratives,https://x.com/billdmccarthy/status/1843399830233903606/photo/1,2024-10-07 00:20:00,Nature,Incorrectly Captioned Images,"As Hurricane Milton roars toward Florida, posts are falsely linking this video to the storm.

The clip has been repeatedly misrepresented, including after Hurricane Ian. It dates to 2021, and meteorologists have said it shows different cloud patterns.

https://t.co/il9uAT3IEJ https://t.co/HbQBLfVdBP",Bill McCarthy
fake_sample,batch2,84,Hurricane Milton is destroying everything in its path ,./media/batch2/84/images/img0.jpeg,False,S p r i n t e r,https://x.com/SprinterFamily/status/1844141392186180037,2024-10-09 22:22:25,Nature,Incorrectly Captioned Images,"This eighth and final clip from the viral video compilation falsely claiming to show Hurricane Milton was actually recorded as Hurricane Idalia toppled a gas station in Perry, Florida, in August 2023.

https://t.co/IJ2hcoQJUn https://t.co/6BbzQsFHBN",Bill McCarthy
fake_sample,batch2,85,Dude gets caught inside hurricane Milton in his car SCARY#Milton#HurricanMilton #Florida #HurricaneMilton,./media/batch2/85/images/img0.jpeg,False,DLG,https://x.com/billdmccarthy/status/1844406140391784630/photo/1,2024-10-10 04:15:00,Nature,Misattributed Images,"Hurricane Milton whipped up a spate of deadly tornadoes as it tore across Florida, but this video of a panicked driver caught in a whirlwind is unrelated.

It was filmed as a twister struck Moss Point, Mississippi more than a year earlier, in June 2023.

https://t.co/fbhFaqoPlw https://t.co/gsXdGWPHOt",Bill McCarthy
fake_sample,batch2,86,BUSTED...THESE are the same earrings she wore at the DEBATE ,./media/batch2/86/images/img0.jpeg,False,Poppi Starr,https://x.com/popstarr65/status/1840201228887773562,2024-09-29 01:25:36,Politics-United-States-Presidential-Election,De-contextualization,"This video, viewed over 4 million times, falsely claims to show Kamala Harris wear a secret earpiece during an interview.

The video was in fact filmed by @CapehartJ in 2019, showing Harris adjusting her in-ear monitor receiver before an MSNBC interview.

https://t.co/WRrbQgxSa1 https://t.co/mcri4JvZhh",Shayan Sardarizadeh
fake_sample,batch2,87,"Hezbollah fires heavy rockets towards central Haifa, settlers flee and hide ",./media/batch2/87/images/img0.jpeg,False,Soul of Resistance,https://x.com/ResistanceSouls/status/1838297568536662253,2024-09-23 19:21:08,Politics-Warfare-Lebanon-Israel Conflict,Incorrectly Captioned Images,"This video is being misrepresented. It dates to at least July 2023 and can be geolocated to Sderot, Israel -- not Haifa. https://t.co/PPhDHe4JFB https://t.co/UG3TZCQFpp",Bill McCarthy
fake_sample,batch2,88,"UPDATE: 2nd Trump Assassination Attempt

The Shooter, Ryan Routh,is believed to have been spotted at Kamala Harris’ North Carolina Rally on September 12 when they bussed everyone in. 

What do you think? Same person? ",./media/batch2/88/images/img0.jpeg,False,MJTruthUltra,https://x.com/MJTruthUltra/status/1836093107445862602,2024-09-17 17:21:24,Politics-United-States-Presidential-Election,De-contextualization,"Conspiracist accounts are claiming Ryan Routh was at a Kamala Harris rally days before his arrest.

But their claims rely on a low-quality video. I obtained the original footage, which clearly shows a different man than the would-be Donald Trump assassin.

https://t.co/BXznzqH4FH https://t.co/IBkUwQnpLx",Bill McCarthy
fake_sample,batch2,89,"#BREAKING: First Photo of Active Shooter at Apalachee High School in Winder, Georgia.#ApalacheeHighSchool #Shooting #ActiveShooter #BarrowCounty #Georgia #BarrowCountySheriff",./media/batch2/89/images/img0.jpeg,False,upuknews,https://x.com/billdmccarthy/status/1832137736725172705/photo/1,2024-09-06 15:24:10,Society,Incorrectly Captioned Images,"Posts claiming this image shows the Georgia high school shooter continue to circulate, but they are false.

The picture is a still from a years-old training video the Indiana State Police created to teach educators how to respond during a shooting. 

https://t.co/paVMxpLMvk https://t.co/g1I3UF4VNk",Bill McCarthy
fake_sample,batch2,90,This video allegedly shows the shooter who tried to assassinate Donald Trump being carried away 😮 ,./media/batch2/90/images/img0.jpeg,False,Paul Golding,https://x.com/GoldingBF/status/1812263629997400132,2024-07-13 23:11:34,Politics-other,Incorrectly Captioned Images,"Some posts have misrepresented this clip, falsely claiming it shows police dragging out the would-be assassin who shot Donald Trump.

The video captures state troopers carrying the victim killed in the attack.

The gunman, meanwhile, was on a nearby roof.

https://t.co/UvL04rv8na https://t.co/lWcJzPeYQS",Bill McCarthy
fake_sample,batch2,91,"Joe Biden calls the Secretary of NATO an “intellectual wigger”

 ",./media/batch2/91/images/img0.jpeg,False,Benny Johnson,https://x.com/bennyjohnson/status/1810832470599741569,2024-07-10 00:24:39,Politics-other,Incorrectly Captioned Images,"Viral claims about Joe Biden insulting Jens Stoltenberg at the Washington summit are false.

The US president did not use a slur or say he slept with Stoltenberg's wife.

He praised the NATO chief's ""intellectual rigor"" and recalled ""talking to"" his wife.

https://t.co/1ew13O6Qj9 https://t.co/qsZFK2Hslh",Bill McCarthy
fake_sample,batch2,92,RIP France ,./media/batch2/92/images/img0.jpeg,False,Mike Lee,https://x.com/BasedMikeLee/status/1810115790064247082,2024-07-08 00:56:49,Politics-Warfare-Israel-Palestine,Incorrectly Captioned Images,"This video, claimed to show supporters of France's New Popular Front waving Palestinian flags during a rally after the country's snap elections, is misrepresented.

The clip shows a pro-Palestinian protest in Lyon roughly a month before the polls.

https://t.co/YTYnTDRgjX https://t.co/2ZOYfZhLxv",Bill McCarthy
fake_sample,batch2,93,Breaking Video: Biden Says He May Resign The Presidency For Medical Reasons ,./media/batch2/93/images/img0.jpeg,False,Alex Jones,https://x.com/RealAlexJones/status/1807538734604431426,2024-06-30 22:16:31,Politics-United-States-Presidential-Election,De-contextualization,"This video does not show Joe Biden saying he may leave the White House for health reasons.

The clip, from 2020, shows him saying he told Barack Obama as VP that if they clashed on ""a moral principle, I'll develop some disease and say I have to resign.""

https://t.co/5bbDfemXda https://t.co/dFoQK0W7Nu",Bill McCarthy
fake_sample,batch2,94,"مشاهد للشرطة الأمريكية تهاجم بوحشية طالبا تضامنا مع فلسطين.

Scenes of American police brutally attacking a student in solidarity with Palestine. ",./media/batch2/94/images/img0.jpeg,False,"Dr.Sam Youssef Ph.D.,M.Sc.,DPT.",https://x.com/drhossamsamy65/status/1785622013379231853,2024-05-01 10:47:17,Society,Misattributed Images,"This video does not show police beating a pro-Palestinian protester on a US university campus.

It is from May 2023 and shows Italian officers beating a transgender woman in an incident that sparked outcry.

Their uniforms say ""Polizia Locale.""

https://t.co/uqne3bKoRv https://t.co/OY8OwjjOp4",Bill McCarthy
fake_sample,batch2,95,"Video circulating about the arrival of the first batch of Iranian drones in Israel.

Unconfirmed!! ",./media/batch2/95/images/img0.jpeg,False,S p r i n t e r,https://x.com/SprinterFamily/status/1779267143902589016,2024-04-13 21:55:18,Politics-Warfare-Israel-Palestine,Incorrectly Captioned Images,"One of the most viral videos misrepresented after Iran's strikes on Israel, this clip was falsely claimed to show people taking cover from drones overhead.

The footage dates to July, when Israel said it intercepted five rockets fired at Sderot from Gaza.

https://t.co/PPhDHe4JFB https://t.co/plUcSEs9WR | This video falsely claims to show people in Israel taking cover upon the ""arrival of the first batch of Iranian drones"" tonight.

It's in fact old footage that has been online since at least July 2023. It's unrelated to tonight's attack, via @ArsenKeklikoglu. https://t.co/QQkif7NqfF",Bill McCarthy; Shayan Sardarizadeh
fake_sample,batch2,96,MARK THIS TWEET IN HISTORY WW3 HAS OFFICIALLY STARTED🚨 ,./media/batch2/96/images/img0.jpeg,False,Matt Wallace,https://x.com/MattWallace888/status/1779256149331644739,2024-04-13 21:11:37,Politics-Warfare-Israel-Palestine,Incorrectly Captioned Images,This clip is from a World War II animation that dates back to 2021. It does not show Iran's unprecedented assault on Israel https://t.co/wqKMgTAQWH https://t.co/3aPwQSqQTe,AFP Fact Check 🔎
fake_sample,batch2,97,"🚨Update: US is preparing for the coming conflict with Iran!! 
US Air Force B-52H long-range bombers loaded with cruise missiles and other munitions! 
",./media/batch2/97/images/img0.jpeg,False,US Civil Defense News,https://x.com/CaptCoronado/status/1780579457469665413,2024-04-17 12:49:58,Politics-other,De-contextualization,"X users falsely claimed this clip shows the US mobilizing bombers with nuclear warheads for war with Iran.

The video, from before Iran's attack on Israel, shows a military training officials said was planned ""well in advance of any current world events.""

https://t.co/rwZk7tQnOV https://t.co/vJLYQnvsO9",Bill McCarthy
fake_sample,batch2,98,ISRAELIS ARE IN FULL PANIC AFTER MISSILES HIT ISRAEL ...!!#IRAN | #ISRAEL,./media/batch2/98/images/img0.jpeg,False,null,https://x.com/billdmccarthy/status/1779984133931868444/photo/1,2024-04-11 21:24:22,Politics-Warfare-Israel-Palestine,Incorrectly Captioned Images,"Social media flooded with misrepresented visuals after Iran attacked Israel, including this clip.

Falsely claimed to show Israelis fleeing, it is actually footage of Louis Tomlinson's fans in Buenos Aires.

Here is how to verify something like this (1/6)

https://t.co/QHJxr4ZmbN https://t.co/daOjAywfmS",Bill McCarthy
fake_sample,batch2,99,"#BREAKING A L E R T – Iran has started to attack Israel-Tel Aviv with heavy missiles; fires of hell are burning, several buildings destroyedWW3INFO",./media/batch2/99/images/img0.jpeg,False,Jack Straw,https://x.com/Shayan86/status/1776041373059150118/photo/1,2024-04-05 00:26:00,Politics-Warfare-War-in-Ukraine,Misattributed Images,"This video is being widely shared tonight with false claims that it shows an Iranian missile attack on Israel in retaliation for the deadly strike on the Iranian consulate in Damascus.

In fact, the video shows Ukrainian missiles target Russian ships in Sevastopol on 23 March. https://t.co/rxrQbiVc2n",Shayan Sardarizadeh
fake_sample,batch2,100,"🚨احتفالات في الشارع اللبناني بمناسبة م قل حسن زباله 
✍️الله يحمي الشعب اللبناني الحر لشريف فقط بدون الروافض الانجاس 🇱🇧❤️ ",./media/batch2/100/images/img0.jpeg,False,قُرَيْشٍ,https://x.com/Quraish911/status/1839793625061785688,2024-09-27 22:25:56,Politics-Warfare-Lebanon-Israel Conflict,De-contextualization,"This video has nothing to do with the current reports of people celebrating the alleged death of Nasrallah - The video was uploaded to Tiktok years ago, in January 2020. https://t.co/6jJK2GaGLm",Tal Hagin
fake_sample,batch3,1,"❗️ Diseased Ukrainian soldiers are being cremated in a field facility brought to the city of Nikolayev (remains under Ukrainian control) by Scottish forces, as stated by media citing pro-Russian undeground coordinator in Ukraine Sergei Lebedev. He claims that the bodies are ",./media/batch3/1/images/img0.jpeg,False,Russian Embassy in South Africa 🇷🇺,https://x.com/EmbassyofRussia/status/1840691493800992812,2024-09-30 09:53:45,Politics-Warfare-War-in-Ukraine,De-contextualization,"Another iteration of a Russian conspiracy theory about organ harvesting in Ukraine. 
Claims like these have been circulating literally for years. 
For example, we investigated something similar - a made up story about “mobile crematoriums” - back in 2022. https://t.co/hzMS6eVGAV https://t.co/gHkDs3lDVt",Olga Robinson
fake_sample,batch3,2,"“54” is a completely different age now than it once was if you take care of your genetic potential with sleep, nutrition, and exercise ",./media/batch3/2/images/img0.jpeg; ./media/batch3/2/images/img1.jpeg,False,ib,https://x.com/Indian_Bronson/status/1860729159242174730,2024-11-24 16:56:16,Society,Incorrectly Captioned Images,"The actress here, Bea Arthur, is at least 63 in this photo.This post also compares a character image where Bea is stylized to look elderly to an event image meant to make the figure look their best. ",Helpful Community Notes
fake_sample,batch3,3,Alexei Navalny died from the COVID vaccine and the fact that nobody wants to admit it is shameful.Why would you blame Putin for something Navalny did to himself by taking an experimental MRNA vaccine?,./media/batch3/3/images/img0.jpeg,False,Bruin Republicans at UCLA,https://x.com/O_Rob1nson/status/1759205560300249344/photo/1,2024-02-18 13:17:44,Politics-Warfare-War-in-Ukraine,Incorrectly Captioned Images,"There’s no evidence Navalny’s death has anything to do with vaccines. 

There is no independent info about the causes of death so far. Russian authorities haven’t released the body yet to the family and offered multiple explanations - from cause “not determined” to “sudden death” https://t.co/hiuC6LrInj",Olga Robinson
