sample_type,batch_file,tweet_id,text,images,label,author,post_url,date_posted,topic,error_category,flagging_tweet_text,flagging_tweet_authors
real_sample,batch11,12,"President Trump issues a ""last warning"" to Hamas to release all hostages, as the US holds direct talks with the militant group",./media/batch11/12/images/img0.jpeg,,CNN,https://x.com/CNN/status/1897450055499501572,2025-03-06 00:52:00,Politics-Warfare-Israel-Palestine,,,
real_sample,batch11,13,"Hamas rejects Israeli ceasefire, hostage return deal over disarmament demands",./media/batch11/13/images/img0.jpeg,,Fox News,https://x.com/FoxNews/status/1912387825300816031,2025-04-16 06:09:22,Politics-Warfare-Israel-Palestine,,,
real_sample,batch11,14,"Israel says it's carrying out ""extensive strikes"" against Hamas in Gaza, throwing doubt on the fragile ceasefire",./media/batch11/14/images/img0.jpeg,,CNN,https://x.com/CNN/status/1901805430109536681,2025-03-18 01:18:43,Politics-Warfare-Israel-Palestine,,,
real_sample,batch11,15,"Latest round of hostage releases begins as Israeli soldier Agam Berger, 20, is handed to Red Cross in Gaza. Follow live updates.",./media/batch11/15/images/img0.jpeg,,CNN,https://x.com/CNN/status/1884879553186648219,2025-01-30 08:21:19,Politics-Warfare-Israel-Palestine,,,
real_sample,batch11,16,"Eight hostages due to be freed Thursday, including 3 Israelis and 5 Thais, have been released. Israel condemned the chaotic handover scenes.",./media/batch11/16/images/img0.jpeg,,CNN,https://x.com/CNN/status/1884934316058108394,2025-01-30 11:58:55,Politics-Warfare-Israel-Palestine,,,
real_sample,batch11,17,Israel delays planned release of 110 Palestinian prisoners after chaotic handover of hostages in Gaza,./media/batch11/17/images/img0.jpeg,,CNN,https://x.com/CNN/status/1884952560592667007,2025-01-30 13:11:25,Politics-Warfare-Israel-Palestine,,,
real_sample,batch11,18,Israeli Prime Minister Benjamin Netanyahu says the Gaza ceasefire will end if Hamas does not release hostages on Saturday,./media/batch11/18/images/img0.jpeg,,CNN,https://x.com/CNN/status/1889373074123874388,2025-02-11 17:56:58,Politics-Warfare-Israel-Palestine,,,
real_sample,batch11,19,"Israel says it is delaying the expected release of hundreds of Palestinian prisoners until Hamas guarantees its next hostage release free of ""humiliating ceremonies""",./media/batch11/19/images/img0.jpeg,,CNN,https://x.com/CNN/status/1893459719898980626,2025-02-23 00:35:50,Politics-Warfare-Israel-Palestine,,,
real_sample,batch11,20,Hamas hands three male Israeli hostages over in the latest round of releases under ceasefire with Israel,./media/batch11/20/images/img0.jpeg,,CNN,https://x.com/CNN/status/1890691995422634135,2025-02-15 09:17:53,Politics-Warfare-Israel-Palestine,,,
real_sample,batch11,21,FLASHBACK: Biden proclaimed Trans Day of Visibility in 2024 that coincided with Easter Sunday,./media/batch11/21/images/img0.jpeg,,Fox News,https://x.com/FoxNews/status/1913181747342123427,2025-04-18 10:44:08,Politics-Warfare-Israel-Palestine,De-contextualization,,
real_sample,batch11,22,Protesters gather at Trump Tower to denounce the arrest of Palestinian activist who helped lead Columbia University demonstrations,./media/batch11/22/images/img0.jpeg,,CNN,https://x.com/CNN/status/1900246736704041120,2025-03-13 18:05:01,Politics-Warfare-Israel-Palestine,,,
real_sample,batch11,23,"Israel launches its first ground offensive since the end of the Gaza ceasefire, partially recapturing a key area",./media/batch11/23/images/img0.jpeg,,CNN,https://x.com/CNN/status/1902389903629132258,2025-03-19 16:01:12,Politics-Warfare-Israel-Palestine,,,
real_sample,batch11,24,Israel says Bibas boys were among the dead bodies returned by Hamas – but not their mother,./media/batch11/24/images/img0.jpeg,,CNN,https://x.com/CNN/status/1892726876709277747,2025-02-21 00:03:47,Politics-Warfare-Israel-Palestine,,,
real_sample,batch11,25,"Hamas has handed over three hostages, including an Israeli-American hostage and two other hostages earlier, in the latest round of releases under the ceasefire deal. Israel is expected to release nearly 200 Palestinian prisoners. Follow live updates.",./media/batch11/25/images/img0.jpeg,,CNN,https://x.com/CNN/status/1885623143831679300,2025-02-01 09:36:05,Politics-Warfare-Israel-Palestine,,,
real_sample,batch11,26,Hamas fires its first missiles at Israel since a ceasefire collapsed earlier this week as new Israeli strikes overnight killed dozens of people,./media/batch11/26/images/img0.jpeg,,CNN,https://x.com/CNN/status/1902707187585298649,2025-03-20 13:01:58,Politics-Warfare-Israel-Palestine,,,
real_sample,batch11,27,"President Trump says the US ""will take over"" the Gaza Strip, after earlier saying he doesn't think there is a permanent future for Palestinians in Gaza",./media/batch11/27/images/img0.jpeg,,CNN,https://x.com/CNN/status/1886937145325068569,2025-02-05 00:37:27,Politics-Warfare-Israel-Palestine,,,
real_sample,batch11,28,Classes are set to resume on Monday at Florida State University after Thursday's deadly mass shooting. FSU says it is waiving all mandatory attendance policies that could affect any students' grades.,./media/batch11/28/images/img0.jpeg,,ABC News,https://x.com/ABC/status/1914047909676429630,2025-04-20 20:05:57,Politics-Warfare-Israel-Palestine,Named Entity Manipulations,,
real_sample,batch11,29,"California girl cries while recounting trans athlete experience, school board president says 'wrap it up'",./media/batch11/29/images/img0.jpeg,,Fox News,https://x.com/FoxNews/status/1913210452428849378,2025-04-18 12:38:12,Politics-Warfare-Israel-Palestine,Miscaptioned Images,,
real_sample,batch11,30,An Israeli security official says four bodies have been transferred to the Red Cross by Hamas.,./media/batch11/30/images/img0.jpeg,,CNN,https://x.com/CNN/status/1894884598632309197,2025-02-26 22:57:48,Politics-Warfare-Israel-Palestine,,,
real_sample,batch11,31,Prime Minister Benjamin Netanyahu's government votes to dismiss the head of Israel's internal security service Shin Bet,./media/batch11/31/images/img0.jpeg,,CNN,https://x.com/CNN/status/1902876918224986445,2025-03-21 00:16:25,Politics-Warfare-Israel-Palestine,,,
real_sample,batch11,32,Opinion | Harvard is fighting the White House harder than it ever fought antisemitism,./media/batch11/32/images/img0.jpeg,,Fox News,https://x.com/FoxNews/status/1912494822553759882,2025-04-16 13:14:32,Politics-Warfare-Israel-Palestine,,,
real_sample,batch11,33,Israel and Hamas agree on new exchange as fragile Gaza ceasefire appears intact for now,./media/batch11/33/images/img0.jpeg,,CNN,https://x.com/CNN/status/1894649299624992996,2025-02-26 07:22:48,Politics-Warfare-Israel-Palestine,,,
real_sample,batch11,34,"More than 50,000 Palestinians have been killed in Gaza since start of Israel-Hamas war, health ministry in the territory says",./media/batch11/34/images/img0.jpeg,,CNN,https://x.com/CNN/status/1903760193206534178,2025-03-23 10:46:14,Politics-Warfare-Israel-Palestine,,,
real_sample,batch11,35,"A plan for Gaza formulated by Egypt would exclude Hamas from governance of the enclave once the war ends, a draft obtained by CNN shows",./media/batch11/35/images/img0.jpeg,,CNN,https://x.com/CNN/status/1896911918264115686,2025-03-04 13:13:38,Politics-Warfare-Israel-Palestine,,,
real_sample,batch11,36,"Trump announces a conservative media star, a GOP governor,and others for Homeland Security Advisory Council",./media/batch11/36/images/img0.jpeg,,Fox News,https://x.com/FoxNews/status/1913236764325564818,2025-04-18 14:22:45,Politics-Warfare-Israel-Palestine,De-contextualization,,
real_sample,batch11,37,Israeli authorities say they are preparing to receive a body said to be Shiri Bibas,./media/batch11/37/images/img0.jpeg,,CNN,https://x.com/CNN/status/1893041628262096943,2025-02-21 20:54:29,Politics-Warfare-Israel-Palestine,,,
real_sample,batch11,38,"Israel's security cabinet approves Gaza ceasefire and hostage deal. The full cabinet will vote on the agreement soon.

Follow live updates:",./media/batch11/38/images/img0.jpeg,,CNN,https://x.com/CNN/status/1880243248578355453,2025-01-17 13:18:18,Politics-Warfare-Israel-Palestine,,,
real_sample,batch11,39,Israel stops humanitarian aid into Gaza after Hamas rejects an extension of the ceasefire's first phase,./media/batch11/39/images/img0.jpeg,,CNN,https://x.com/CNN/status/1896108358454726724,2025-03-02 08:00:35,Politics-Warfare-Israel-Palestine,,,
real_sample,batch11,40,Israel launches airstrikes on Hezbollah targets in southern Lebanon in most significant flare-up of tensions since truce with militant group began,./media/batch11/40/images/img0.jpeg,,CNN,https://x.com/CNN/status/1903400108370338204,2025-03-22 10:55:23,Politics-Warfare-Lebanon-Israel Conflict,,,
real_sample,batch11,41,The cost of the US military offensive against the Houthis is nearing $1 billion even as the attacks have had limited impact,./media/batch11/41/images/img0.jpeg,,CNN,https://x.com/CNN/status/1908226865216536830,2025-04-04 18:35:12,Politics-Warfare-Middle-East-Conflict,,,
real_sample,batch11,42,President Trump says he has ordered a “decisive” military action against Houthi rebels in Yemen,./media/batch11/42/images/img0.jpeg,,CNN,https://x.com/CNN/status/1900992210302366064,2025-03-15 19:27:16,Politics-Warfare-Middle-East-Conflict,,,
real_sample,batch11,43,Opinion | Why is Good Friday ‘Good’?,./media/batch11/43/images/img0.jpeg,,Fox News,https://x.com/FoxNews/status/1913218594625683872,2025-04-18 13:10:33,Politics-Warfare-Middle-East-Conflict,Miscaptioned Images,,
real_sample,batch11,44,National security leaders accidentally included the Atlantic's editor-in-chief in a group Signal chat about strikes on Houthi targets in Yemen,./media/batch11/44/images/img0.jpeg,,CNN,https://x.com/CNN/status/1904254645758738791,2025-03-24 19:31:01,Politics-Warfare-Middle-East-Conflict,,,
real_sample,batch11,45,"Four people from Wisconsin were killed on Saturday when their private, single-engine plane crashed in a field near an airport in rural Illinois, authorities said.",./media/batch11/45/images/img0.jpeg,,ABC News,https://x.com/ABC/status/1914041652013920507,2025-04-20 19:41:05,Politics-Warfare-Middle-East-Conflict,Miscaptioned Images,,
real_sample,batch11,46,"Pres. Trump's tariffs sparked recession alarm, but data shows a solid economy. Here's why:",./media/batch11/46/images/img0.jpeg,,ABC News,https://x.com/ABC/status/1914138365844222402,2025-04-21 02:05:24,Politics-Warfare-Middle-East-Conflict,Miscaptioned Images,,
real_sample,batch11,47,"Defense Secretary Pete Hegseth shared details about an imminent attack on Houthis in Yemen in March in a second Signal group chat that included his wife, his brother and his personal lawyer, sources familiar with the contents of the chat told ABC News.",./media/batch11/47/images/img0.jpeg,,ABC News,https://x.com/ABC/status/1914132989044314184,2025-04-21 01:44:02,Politics-Warfare-Middle-East-Conflict,De-contextualization,,
real_sample,batch11,48,"Sen. Chris Van Hollen slammed El Salvador President Nayib Bukele and President Donald Trump for what he said was a setup to defame him and Kilmar Abrego Garcia, the man at the center of an erroneous deportation, during their meeting in El Salvador.",./media/batch11/48/images/img0.jpeg,,ABC News,https://x.com/ABC/status/1914089870298866132,2025-04-20 22:52:41,Politics-Warfare-Middle-East-Conflict,De-contextualization,,
real_sample,batch11,49,"Current and former Seattle police officers who attended President Trump's ""Stop the Steal"" political rally on Jan. 6, 2021, at the U.S. Capitol are asking the nation's highest court to keep their identities anonymous in public court records.",./media/batch11/49/images/img0.jpeg,,ABC News,https://x.com/ABC/status/1914064054521299316,2025-04-20 21:10:06,Politics-Warfare-Middle-East-Conflict,Named Entity Manipulations,,
real_sample,batch11,50,Al Sharpton holds 'constructive and candid' meeting with Target CEO over DEI initiatives,./media/batch11/50/images/img0.jpeg,,Fox News,https://x.com/FoxNews/status/1913222708344529099,2025-04-18 13:26:54,Politics-Warfare-Middle-East-Conflict,Miscaptioned Images,,
real_sample,batch11,51,"Young women ages 18 to 25 in the United States are now binge drinking more than their male peers, a reversal of prior trends, according to a new research letter published Wednesday.",./media/batch11/51/images/img0.jpeg,,ABC News,https://x.com/ABC/status/1914053619411808749,2025-04-20 20:28:38,Politics-Warfare-Middle-East-Conflict,Miscaptioned Images,,
real_sample,batch11,52,"Becky Lynch makes epic return, helps Lyra Valkyria win tag-team gold at WrestleMania 41",./media/batch11/52/images/img0.jpeg,,Fox News,https://x.com/FoxNews/status/1914188406000701754,2025-04-21 05:24:14,Politics-Warfare-Middle-East-Conflict,Miscaptioned Images,,
real_sample,batch11,53,LGBTQ Christians crusade against Trump's 'anti-LGBTQ' orders during Holy Week,./media/batch11/53/images/img0.jpeg,,Fox News,https://x.com/FoxNews/status/1913252029918564839,2025-04-18 15:23:25,Politics-Warfare-Middle-East-Conflict,Miscaptioned Images,,
real_sample,batch11,54,"Michelle Williams, the Destiny's Child singer currently starring in Broadway's ""Death Becomes Her,"" shared a backstage video, showing her long-awaited meeting with actress Michelle Williams.",./media/batch11/54/images/img0.jpeg,,ABC News,https://x.com/ABC/status/1914096876250427689,2025-04-20 23:20:32,Politics-Warfare-Middle-East-Conflict,Named Entity Manipulations,,
real_sample,batch11,55,"An Arizona toddler who had been missing for 16 hours was found safe by a rancher's dog, according to authorities.",./media/batch11/55/images/img0.jpeg,,ABC News,https://x.com/ABC/status/1914103682402037760,2025-04-20 23:47:34,Natural-Scenery,Miscaptioned Images,,
real_sample,batch11,56,Residents in northern Los Angeles County are under mandatory evacuation orders in the first significant wildfire outbreak since fatal fires in LA,./media/batch11/56/images/img0.jpeg,,CNN,https://x.com/CNN/status/1882164758935224476,2025-01-22 20:33:42,Nature-Disaster,,,
real_sample,batch11,57,Rising river levels in Kentucky prompt evacuations and warnings to move to safer ground with water rescues underway as violent storms sweep through central US,./media/batch11/57/images/img0.jpeg,,CNN,https://x.com/CNN/status/1909005680276611268,2025-04-06 22:09:56,Nature-Disaster,,,
real_sample,batch11,58,"Update: Seven people are dead, including one in a car on the ground, after a medevac jet carrying a child patient and her mother crashed in a neighborhood in northeast Philadelphia Friday night, Philadelphia’s mayor has said",./media/batch11/58/images/img0.jpeg,,CNN,https://x.com/CNN/status/1885738418828685645,2025-02-01 17:14:09,Nature-Disaster,,,
real_sample,batch11,59,"6 Mexican nationals are dead after a medevac jet carrying a child patient and her mother crashed in Philadelphia, Mexico's president says",./media/batch11/59/images/img0.jpeg,,CNN,https://x.com/CNN/status/1885726202679226839,2025-02-01 16:25:36,Nature-Disaster,,,
real_sample,batch11,60,At least 66 people are dead after a fire breaks out at a ski resort hotel in northwestern Turkey,./media/batch11/60/images/img0.jpeg,,CNN,https://x.com/CNN/status/1881688531174572155,2025-01-21 13:01:20,Nature-Disaster,,,
real_sample,batch11,61,"Central Myanmar rocked by 7.7-magnitude quake, US Geological Survey says",./media/batch11/61/images/img0.jpeg,,CNN,https://x.com/CNN/status/1905512804963975315,2025-03-28 06:50:30,Nature-Disaster,,,
real_sample,batch11,62,Myanmar's ruling military announces a temporary ceasefire against armed opponents following last week's deadly earthquake,./media/batch11/62/images/img0.jpeg,,CNN,https://x.com/CNN/status/1907444548227224043,2025-04-02 14:46:33,Nature-Disaster,,,
real_sample,batch11,63,"A plane matching the description of a flight that disappeared in Alaska with 10 people on board has been found, officials say. At least three are dead.",./media/batch11/63/images/img0.jpeg,,CNN,https://x.com/CNN/status/1888013934906507379,2025-02-07 23:56:14,Nature-Disaster,,,
real_sample,batch11,64,"Six people have died after a tourist submarine sank off the coast of the Red Sea resort town of Hurghada in Egypt, local media reports",./media/batch11/64/images/img0.jpeg,,CNN,https://x.com/CNN/status/1905219972151845097,2025-03-27 11:26:53,Nature-Disaster,,,
real_sample,batch11,65,"Six people, including three children, were killed when a helicopter crashed into the Hudson River, New York City Mayor Eric Adams said",./media/batch11/65/images/img0.jpeg,,CNN,https://x.com/CNN/status/1910453374341828666,2025-04-10 22:02:33,Nature-Disaster,,,
real_sample,batch11,66,"Fire chief warns of ""very high"" fire threat as shifting conditions make it tricky for firefighters to get Los Angeles blazes fully contained. 

Follow live updates.",./media/batch11/66/images/img0.jpeg,,CNN,https://x.com/CNN/status/1878481711912128536,2025-01-12 16:38:35,Nature-Disaster,,,
real_sample,batch11,67,A strengthening cross-country storm is hitting the US Plains with hurricane-force winds and threatens a tornado outbreak this weekend in the US South,./media/batch11/67/images/img0.jpeg,,CNN,https://x.com/CNN/status/1900621269281775820,2025-03-14 18:53:17,Nature-Disaster,,,
real_sample,batch11,68,Firefighting helicopter crashes as South Korea battles 'unprecedented' wildfires that have killed at least 19 and torched a centuries-old temple,./media/batch11/68/images/img0.jpeg,,CNN,https://x.com/CNN/status/1904777633767760096,2025-03-26 06:09:11,Nature-Disaster,,,
real_sample,batch11,69,A Russian citizen accused of money laundering is being released from US custody as part of the exchange that freed American teacher Marc Fogel,./media/batch11/69/images/img0.jpeg,,CNN,https://x.com/CNN/status/1889706672551072004,2025-02-12 16:02:34,Politics-other,,,
real_sample,batch11,70,Rubio announces closure of State Department effort that 'was supposed to be dead already',./media/batch11/70/images/img0.jpeg,,Fox News,https://x.com/FoxNews/status/1912816683099501027,2025-04-17 10:33:30,Politics-other,,,
real_sample,batch11,71,"South Korean President Yoon Suk Yeol has been arrested, according to the country’s anti corruption agency, the latest chapter in a weekslong political showdown that began with the embattled president’s shock martial law decree last month.",./media/batch11/71/images/img0.jpeg,,CNN,https://x.com/CNN/status/1879350721276981673,2025-01-15 02:11:43,Politics-other,,,
real_sample,batch11,72,President Donald Trump hosts Easter dinner with 'worship and prayers',./media/batch11/72/images/img0.jpeg,,Fox News,https://x.com/FoxNews/status/1912890377515737524,2025-04-17 15:26:20,Politics-other,,,
real_sample,batch11,73,Istanbul mayor jailed as tens of thousands of people in Turkey protest against his detention,./media/batch11/73/images/img0.jpeg,,CNN,https://x.com/CNN/status/1903721502547010011,2025-03-23 08:12:30,Politics-other,,,
real_sample,batch11,74,US military is ordering thousands more troops to the southern border with Mexico days after Trump mandated an increased presence there,./media/batch11/74/images/img0.jpeg,,CNN,https://x.com/CNN/status/1882104951729467889,2025-01-22 16:36:02,Politics-other,,,
real_sample,batch11,75,Trump takes center stage in Canada’s prime minister election debate,./media/batch11/75/images/img0.jpeg,,Fox News,https://x.com/FoxNews/status/1913053122315915278,2025-04-18 02:13:01,Politics-other,Deepfakes,,
real_sample,batch11,76,Bipartisan senators push tougher penalties for foreign-backed crimes on US soil,./media/batch11/76/images/img0.jpeg,,Fox News,https://x.com/FoxNews/status/1912540589892960323,2025-04-16 16:16:24,Politics-other,,,
real_sample,batch11,77,"Elon Musk's associates sought to use a critical Treasury payment system to shut down USAID spending just days after Trump's inauguration, emails show",./media/batch11/77/images/img0.jpeg,,CNN,https://x.com/CNN/status/1887534907301257328,2025-02-06 16:12:45,Politics-other,,,
real_sample,batch11,78,President Trump has temporarily reinstated a tariff loophole that allows packages worth less than $800 to enter the US duty-free,./media/batch11/78/images/img0.jpeg,,CNN,https://x.com/CNN/status/1887924392044192118,2025-02-07 18:00:25,Politics-other,,,
real_sample,batch11,79,Rachel Morin's mother tearfully begs media to 'tell the truth' about criminal illegal immigrants,./media/batch11/79/images/img0.jpeg,,Fox News,https://x.com/FoxNews/status/1912677472459518260,2025-04-17 01:20:19,Politics-other,,,
real_sample,batch11,80,A jury has found Greenpeace liable for hundreds of millions of dollars in relation to Dakota Access Pipeline protest damages,./media/batch11/80/images/img0.jpeg,,CNN,https://x.com/CNN/status/1902461768599048432,2025-03-19 20:46:46,Politics-other,,,
real_sample,batch11,81,"President Trump is expected to unveil sweeping new tariffs soon. America's trade partners have warned they will retaliate.

Follow live updates.",./media/batch11/81/images/img0.jpeg,,CNN,https://x.com/CNN/status/1907523704856125447,2025-04-02 20:01:05,Politics-other,,,
real_sample,batch11,82,The Trump administration has asked the Supreme Court to freeze millions of dollars in grants to states intended to address teacher shortages,./media/batch11/82/images/img0.jpeg,,CNN,https://x.com/CNN/status/1904937755651547461,2025-03-26 16:45:27,Politics-other,,,
real_sample,batch11,83,A federal judge has found that the Trump administration's mass firings of federal probationary workers were likely unlawful,./media/batch11/83/images/img0.jpeg,,CNN,https://x.com/CNN/status/1895269726030356615,2025-02-28 00:28:09,Politics-other,,,
real_sample,batch11,84,President Trump's acting commissioner is out at the IRS just two days after his appointment was announced,./media/batch11/84/images/img0.jpeg,,CNN,https://x.com/CNN/status/1913285916543611165,2025-04-18 17:38:04,Politics-other,,,
real_sample,batch11,85,Judge won't pause deportation flights under Alien Enemies Act. The Trump administration says it reserves right to remove people tomorrow.,./media/batch11/85/images/img0.jpeg,,CNN,https://x.com/CNN/status/1913382078193795494,2025-04-19 00:00:11,Politics-other,,,
real_sample,batch11,86,President Trump's acting commissioner is out at the IRS just two days after his appointment was announced,./media/batch11/86/images/img0.jpeg,,CNN,https://x.com/CNN/status/1913285916543611165,2025-04-18 17:38:04,Politics-other,,,
real_sample,batch11,87,Judge won't pause deportation flights under Alien Enemies Act. The Trump administration says it reserves right to remove people tomorrow.,./media/batch11/87/images/img0.jpeg,,CNN,https://x.com/CNN/status/1913382078193795494,2025-04-19 00:00:11,Politics-other,,,
real_sample,batch11,88,"Fyre Festival 2 'postponed' after Mexico plans derailed, ticket vendor issues refunds",./media/batch11/88/images/img0.jpeg,,Fox News,https://x.com/FoxNews/status/1913205414004433153,2025-04-18 12:18:10,Politics-other,Miscaptioned Images,,
real_sample,batch11,89,"President Trump threatens new ""large scale"" sanctions on Russia after weeks of conciliatory statements toward Moscow",./media/batch11/89/images/img0.jpeg,,CNN,https://x.com/CNN/status/1898029596911571087,2025-03-07 15:14:54,Politics-other,,,
real_sample,batch11,90,Eight inspectors general fired by Trump from their federal agency watchdog posts file a lawsuit to get their jobs back,./media/batch11/90/images/img0.jpeg,,CNN,https://x.com/CNN/status/1889698348501770519,2025-02-12 15:29:29,Politics-other,,,
real_sample,batch11,91,"The White House has rescinded the federal aid freeze that sparked nationwide confusion, according to a memo from a Trump administration official obtained by CNN",./media/batch11/91/images/img0.jpeg,,CNN,https://x.com/CNN/status/1884667021234712767,2025-01-29 18:16:47,Politics-other,,,
real_sample,batch11,92,Investigators have arrived at the residence of impeached South Korean President Yoon Suk Yeol to carry out an arrest warrant,./media/batch11/92/images/img0.jpeg,,CNN,https://x.com/CNN/status/1874958092447645720,2025-01-02 23:16:58,Politics-other,,,
real_sample,batch11,93,"Judge pauses midnight deadline for federal employees to accept Trump administration's ""buyout"" offers as legal challenges play out",./media/batch11/93/images/img0.jpeg,,CNN,https://x.com/CNN/status/1887573709013025021,2025-02-06 18:46:56,Politics-other,,,
real_sample,batch11,94,"Ecuador is preparing for US forces, plans show, as Noboa calls for help battling gangs.",./media/batch11/94/images/img0.jpeg,,CNN,https://x.com/CNN/status/1906058229659947295,2025-03-29 18:57:49,Politics-other,,,
real_sample,batch11,95,A federal judge has frozen parts of the executive order targeting a law firm linked to Robert Mueller's investigation of Trump,./media/batch11/95/images/img0.jpeg,,CNN,https://x.com/CNN/status/1905773816003121510,2025-03-29 00:07:39,Politics-other,,,
real_sample,batch11,96,"In an extraordinary argument, the Justice Department defended the Trump administration's deportation flights, telling a federal judge his oral order ""is not enforceable""",./media/batch11/96/images/img0.jpeg,,CNN,https://x.com/CNN/status/1901725083858575858,2025-03-17 19:59:26,Politics-other,,,
real_sample,batch11,97,"Twenty-one federal workers have resigned in protest over DOGE efforts. The technology staffers were part of the US Digital Service, which later became DOGE.",./media/batch11/97/images/img0.jpeg,,CNN,https://x.com/CNN/status/1894437248013054082,2025-02-25 17:20:11,Politics-other,,,
real_sample,batch11,98,"A federal judge has indefinitely blocked the Trump administration's federal funding freeze, criticizing the move as ""irrational"" and ""imprudent""",./media/batch11/98/images/img0.jpeg,,CNN,https://x.com/CNN/status/1894487887049109528,2025-02-25 20:41:24,Politics-other,,,
