sample_type,batch_file,tweet_id,text,images,label,author,post_url,date_posted,topic,error_category,flagging_tweet_text,flagging_tweet_authors
fake_sample,batch1,1,No none...,./media/batch1/1/images/img0.jpeg,False,Gregory *▄︻デ═══一,https://x.com/Greg4Trump/status/1817934830073446531,2024-07-29 14:46:53,Politics-United-States-Presidential-Election,Deepfakes,And these two images of Kamala Harris alongside Jeffrey Epstein are both obviously AI-generated and fake.,Shayan Sardarizadeh
fake_sample,batch1,2,Our government has failed us again.,./media/batch1/2/images/img0.jpeg,False,Buzz Patterson,https://x.com/BuzzPatterson/status/1841659195579629833,2024-10-03 01:59:03,Nature,Deepfakes,"Another day, another AI generated image of a hurricane Helene victim is doing the rounds. Tell tale signs include the unnatural sheen, a disappearing green boat and a man with a seemingly missing limb in the background. | It's been several days since this purported image of a child affected by Hurricane Helene was widely debunked as an AI-generated fake, and somehow Glenn Beck is still sharing it with his 1.9 million followers today as if it's real.",Olga Robinson; Shayan Sardarizadeh
fake_sample,batch1,3,"We have to help these victims.  Please post anything to offer locations for assistance, supplies needed, etc.  Comrad Kamala and Sleepy Joe have deserted them.",./media/batch1/3/images/img0.jpeg,False,Juanita Broaddrick,https://x.com/atensnut/status/1841132808284103069,2024-10-01 15:07:22,Nature,Deepfakes,This is not a real photo of a hurricane Helene victim. The image is AI generated - obvious from the unnatural sheen and weird details like the black patch on the hand,Olga Robinson
fake_sample,batch1,4,This image reflects current policing strategy perfectly.,./media/batch1/4/images/img0.jpeg,False,Paul Golding,https://x.com/GoldingBF/status/1824007235686559911,2024-08-15 08:56:28,Society,Deepfakes,"The poster doesn’t make it clear but the image is clearly AI generated.You can see some heads missing, extra feet and some slightly odd body shapes.",Olga Robinson
fake_sample,batch1,5,"🚨 TUCKER CARLSON ASSASSINATION PLOT FOILED.Russian forces reportedly arrested a man for a planned attack on Tucker, allegedly orchestrated by Ukraine's Intelligence.The plot allegedly involved an IED targeting Carlson's vehicle at the Four Seasons hotel.The suspect reportedly admitted to receiving $4000 for the attack's execution after being caught.Source: INTEL-DROP",./media/batch1/5/images/img0.jpeg,False,Mario Nawfal,https://x.com/MarioNawfal/status/1762188260644659282,2024-02-26 18:49:55,Politics-other,De-contextualization,Claims that Russia has thwarted an assassination attempt on Tucker Carlson have been viewed millions of times on X.The source? A video on an obscure YT channel amplified by a website that routinely spreads pro-Kremlin disinformation🧵,Olga Robinson
fake_sample,batch1,6,"This photo needs to be the front page of,every news paper in the world.20 tents full of displaced families buried,alive in Gaza.",./media/batch1/6/images/img0.jpeg,False,Mohamad Safa,https://x.com/talhagin/status/1842082081595105381,2024-10-24 21:59:00,Politics-Warfare-Israel-Palestine,Deepfakes,"Based on a reverse-image search, this image is part of an AI artwork created on July 17th and spread via a few accounts. The full video (showcased below) showcases it to clearly be AI-generated.  https://x.com/mhdksafa/statu/mhdksafa/status/1841915936237854887",Tal Hagin
fake_sample,batch1,7,"OMG, all is lost!... Orcs, surrender!!...  Ukrops are entering Kursk!!!...Wait a second...  That's not the Russian letter У...  That's a Y...🤡🐷🤡",./media/batch1/7/images/img0.jpeg,False,"Ignorance, the root and stem of all evil",https://x.com/ivan_8848/status/1825331658909692382,2024-08-19 00:39:15,Politics-Warfare-War-in-Ukraine,Deepfakes,"Beyond the oddity of the letter Y, there are several other issues that clearly show this was AI, namely the fingers and the patches.",Tal Hagin
fake_sample,batch1,8,Look what I found.  Trumps own mother says it. Let’s get it trending. #disasterTrump,./media/batch1/8/images/img0.jpeg; ./media/batch1/8/images/img1.jpeg,False,Robert Stern,https://x.com/RobertCStern/status/1845968561493127381,2024-10-14 23:22:56,Politics-United-States-Presidential-Election,Deepfakes,"Pretty sure this meme, which features a fake quote attributed to Mary Anne MacLeod Trump, has been circulating online since 2017.Here it is again seven years later, with 63,000 likes and 2 million views.",Shayan Sardarizadeh
fake_sample,batch1,9,Get ready for lots of rage from Mar a lago tonight.,./media/batch1/9/images/img0.jpeg; ./media/batch1/9/images/img1.jpeg,False,Joe G,https://x.com/EastEndJoe/status/1829335418711498927,2024-08-30 01:48:45,Politics-United-States-Presidential-Election,Deepfakes,"This image of a Fox News poll, viewed 330,000 times, is totally fake. None of these poll numbers for Harris and Trump are real.",Shayan Sardarizadeh
fake_sample,batch1,10,"Imagine still believing in this never ending hoax. The climate cult hoaxers have never been right about a single prediction in 50 years. And yet, despite a 0.00% record of their dire predictions, there’s still gullible fools who make it their religion.",./media/batch1/10/images/img0.jpeg,False,Catturd ™,https://x.com/catturd2/status/1823515844497866896,2024-08-14 00:23:51,Society,Deepfakes,"In today's shock news, influencer Catturd appears unaware that the supposed 1977 Time magazine front cover warning of a 'coming ice age' that he's posted is fake.The real Time cover, published in 2007,  is actually about global warming.",Shayan Sardarizadeh
fake_sample,batch1,11,Become woke’s worst nightmare.,./media/batch1/11/images/img0.jpeg,False,iamyesyouareno,https://x.com/iamyesyouareno/status/1776485923707834809,2024-04-06T05:43:44,Society,De-contextualization,AI-generated images are apparently 'woke's worst nightmare'.,Shayan Sardarizadeh
fake_sample,batch1,12,🚨BREAKING🚨 — Former President Jimmy Carter has passed away. He was 99 years old.,./media/batch1/12/images/img0.jpeg; ./media/batch1/12/images/img1.jpeg,False,Boccaccio ✺,https://x.com/Bocc_accio/status/1815661822805958679,2024-07-23 08:14:46,Politics-other,Deepfakes,"Some 'citizen journalists' on this app are sharing a blatantly fake letter from the office of former President Jimmy Carter announcing his death. | A supposed letter from the office of Jimmy Carter announcing his death went viral today, amplified by US media outlets and a senator.It was a hoax.https://factcheck.afp.com/doc.afp.com.364T47M",Shayan Sardarizadeh; Bill McCarthy
fake_sample,batch1,13,KAMALA HARRIS IS PART OF A CULT ⚠️ Her purple suit and white bead necklace were intentional. They were trying to manifest her becoming president since day 1 by copying Lisa from the Simpsons 🚨 KEEP THIS WOMAN AND HER CREEPY HUSBAND AWAY FROM THE WHITE HOUSE AT ALL COSTS 🚨,./media/batch1/13/images/img0.jpeg,False,Matt Wallace,https://x.com/MattWallace888/status/1815201576144851124,2024-07-22 01:45:55,Politics-United-States-Presidential-Election,De-contextualization,One of the biggest conspiracy theorists on this platform continues to outdo himself.,Shayan Sardarizadeh
fake_sample,batch1,14,"It’s my birthday today, and a wish from you could make it even brighter😊😊😊",./media/batch1/14/images/img0.jpeg,False,Alma Hanna,https://x.com/hannanative/status/1846736456028664167,2024-10-17 02:14:16,Society,De-contextualization,Engagement farming with AI-generated female soldiers demanding birthday wishes 🥴,Shayan Sardarizadeh
fake_sample,batch1,15,Where is this?,./media/batch1/15/images/img0.jpeg,False,Morgan J. Freeman,https://x.com/mjfree/status/1838734829011059007,2024-09-25 00:18:39,Society,Deepfakes,"Nowhere, dude. It's AI-generated.",Shayan Sardarizadeh
fake_sample,batch1,16,THEIR ALREADY LINING UP FOR THE ANTHOLOGY WTF Y'ALL GO HOME 🏡 😭 ,https://pbs.twimg.com/media/GdhGF8tWMAAAZ1z.jpg,False,Autumn's version 🍁🍂,https://x.com/aurorabora518/status/1862315515860971775,2024-11-29 01:59:53,Entertainment,Misattributed Images,This is a photo from 2017 it has no association with Taylor Swift,Helpful Community Notes
fake_sample,batch1,17,A view of the #Northernlights #Brighton ^ Hove,./media/batch1/17/images/img0.jpeg,False,𝕏,https://x.com/brightonfy/status/1844490507839472094,2024-10-10 21:29:40,Nature,De-contextualization,Correction: An AI-generated view of the Northern Lights in Brighton.,Shayan Sardarizadeh
fake_sample,batch1,18,Is this real? A “billionaire” is donating $1300??? Embarrassing.,./media/batch1/18/images/img0.jpeg,False,Morgan J. Freeman,https://x.com/mjfree/status/1845634245126934679,2024-10-14 01:14:28,Politics-United-States-Presidential-Election,Deepfakes,"This image, viewed 500,000 times, claims to show Fox News reporting that Donald Trump is donating '$1,300 for hurricane relief'.The image is AI-generated and fake.",Shayan Sardarizadeh
fake_sample,batch1,19,In picture : Hezbollah has captured many Zionist terrorists in South Lebanon.,./media/batch1/19/images/img0.jpeg,False,Haider 🇮🇷 🇱🇧,https://x.com/HaiderAli099/status/1846819909021442156,2024-10-17 07:45:53,Politics-Warfare-Lebanon-Israel Conflict,Deepfakes,"This widely shared image, claiming to show IDF soldiers captured by Hezbollah, is AI-generated and fake.The bizarre rifles, tactical gear and inelligible Hebrew on the vests are all signs of AI.Fact-checked by @GhonchehAzad",Shayan Sardarizadeh
fake_sample,batch1,20,💥The Diddy Client List goes all the way to the top💥,./media/batch1/20/images/img0.jpeg,False,Red Pill USA,https://x.com/Red_Pill_US/status/1835886287980757147,2024-09-17 03:39:34,Politics-other,Deepfakes,An image that appears to show Kamala Harris with Sean 'Diddy' Combs is altered. In the 2001 photo Harris is posing with talk show host Montel Williams and his daughter https://u.afp.com/5EEb,HoaxEye
fake_sample,batch1,21,oops,./media/batch1/21/images/img0.jpeg,False,Andrew Stiles,https://x.com/AndrewStilesUSA/status/1820459027878342657,2024-08-05T13:57:09.000Z,Politics-United-States-Presidential-Election,Deepfakes,🚨Please note: This is a fake image that is circulating.,Washington Post PR
fake_sample,batch1,22,Is this real?! Did Kamala Harris really say this?????,./media/batch1/22/images/img0.jpeg; ./media/batch1/22/images/img1.jpeg,False,Philip Anderson,https://x.com/VoteHarrisOut/status/1817253464172646577,2024-07-27 17:39:23,Politics-United-States-Presidential-Election,Deepfakes,"Fake Kamala Harris quotes and social media posts continue to spread online.She did not post, for example, that a controversial scene from the Olympics opening ceremony was what the United States should 'strive towards.'https://factcheck.afp.com/doc.afp.com.368H493",Bill McCarthy
fake_sample,batch1,23,null,./media/batch1/23/images/img0.jpeg,False,Morgan J. Freeman,https://x.com/mjfree/status/1816666605897560552,2024-07-26 02:47:25,Politics-United-States-Presidential-Election,Deepfakes,Kamala Harris did not challenge Donald Trump to a debate at Jeffrey Epstein's townhouse.This supposed screenshot started as a clearly labeled parody before users circulated it with some signs it was fake cropped out.https://factcheck.afp.com/doc.afp.com.367X63B,Bill McCarthy
fake_sample,batch1,24,"Kamala SLAMS Trump, showing she is a cooler woman than even Nancy Reagan was 🔥",./media/batch1/24/images/img0.jpeg,False,Faith Back Rub,https://x.com/FaithRubPol/status/1815800262017372563,2024-07-23 17:24:53,Politics-United-States-Presidential-Election,De-contextualization,Kamala Harris did not challenge Donald Trump to a debate at Jeffrey Epstein's townhouse.This supposed screenshot started as a clearly labeled parody before users circulated it with some signs it was fake cropped out.https://factcheck.afp.com/doc.afp.com.367X63B,Bill McCarthy
fake_sample,batch1,25,"Diverse nuotatrici olimpiche hanno indossato il costume con una scritta posizionata strategicamente a specificare che 'Not a dude', non sono un ragazzo.Belle, brave e ironiche.Apprezzo moltissimo,Di questi tempi andrebbe resa obbligatoria, magari illuminata a led.Voi che dite?",./media/batch1/25/images/img0.jpeg,False,Simone Pillon,https://x.com/SimoPillon/status/1817809924220403972,2024-07-29 06:30:33,Society,Deepfakes,È veramente vergognoso cascare in queste bufale. Nessuna delle atlete a Parigi 2024 indossa costumi con la scritta 'not a dude'. È ora di finirla!,David Puente
fake_sample,batch1,26,"This isn't a movie scene, it's REAL!

China's $170 BILLION Ghost Cities: Abandoned Skyscrapers and Empty Streets.

You won't believe your eyes 👀 ",./media/batch1/26/images/img0.jpeg,False,Nayeem Sheikh,https://x.com/HeyNayeem/status/1861679087208857900,2024-11-27 07:50:57,Society,Misattributed Images,"The image in this post is not of a Chinese ghost city.It actually depicts Osaka, Japan 🇯🇵, one of the largest cities in the world.For confirmation, refer to the original source: ",Helpful Community Notes
fake_sample,batch1,27,This is Trump’s medical report.,./media/batch1/27/images/img0.jpeg,False,𝕊𝕦𝕟𝕕𝕒𝕖_𝔾𝕦𝕣𝕝,https://x.com/SundaeDivine/status/1813734001859035397,2024-07-18 00:34:18,Politics-United-States-Presidential-Election,Deepfakes,"This 'EMS Transfer of Care Form' is fake, per the Pennsylvania Department of Health, which tells me it has not released any report on Donald Trump's treatment after an assassination attempt.It started with a parody account, as should be evident from its contents.",Bill McCarthy
fake_sample,batch1,28,"WOW, Mariah Carey with a direct message!!!",./media/batch1/28/images/img0.jpeg,False,Xaviaer DuRousseau,https://x.com/XAVIAERD/status/1810399553784520998,2024-07-08 19:44:23,Entertainment,Deepfakes,"This image of Mariah Carey showcasing a message on her phone that says 'Palestine does not exist' is altered.In the original photo the singer posted to her social media, she is holding up her score on a New York Times word puzzle game called 'Connections.'",Bill McCarthy
fake_sample,batch1,29,Front row at the Donald Trump Miami rally tonight? Tua.,./media/batch1/29/images/img0.jpeg,False,Clay Travis,https://x.com/ClayTravis/status/1810814670862684321,2024-07-09 23:13:55,Politics-United-States-Presidential-Election,Deepfakes,"This image, purporting to show a seat reserved for Tua Tagovailoa at Donald Trump's rally last night, is altered.The chair at the Doral, Florida speech was marked for Barron Trump, not the Miami Dolphins quarterback.https://factcheck.afp.com/doc.afp.com.363G6RY",Bill McCarthy
fake_sample,batch1,30,"Yes, orange man bad, and the “Supreme” Court has effectively made him immune from prosecution. There are only two things that can shut him out of our lives forever: One, we destroy him at the ballot box. Two, he finally has that one hamberder too many.",./media/batch1/30/images/img0.jpeg,False,😱 Scary Larry 😱 🇺🇦✊🏻🇺🇸🗽,https://x.com/aintscarylarry/status/1808130479662707009,2024-07-02 13:27:54,Politics-United-States-Presidential-Election,Deepfakes,"When someone says it's 'not photoshopped,' it's usually photoshopped.",Dan Evon
fake_sample,batch1,31,He is now my favorite movie star…I wonder why 😂@FlynnMovie,./media/batch1/31/images/img0.jpeg,False,General Mike Flynn,https://x.com/GenFlynn/status/1798787557351735707,2024-06-06 18:42:28,Society,Deepfakes,Former US national security adviser Gen Michael Flynn appears to have fallen for a clearly doctored image of Mark Wahlberg wearing a T-shirt that brands Dr Anthony Fauci a 'prick'.,Shayan Sardarizadeh
fake_sample,batch1,32,Meanwhile… Krampus March in Norway ,./media/batch1/32/images/img0.jpeg,False,Karli Bonne’ 🇺🇸,https://x.com/KarluskaP/status/1861753457658450219,2024-11-27 12:46:28,Entertainment,Misattributed Images,"This event is taking place in Itter, Austria, not Norway",Helpful Community Notes
fake_sample,batch1,33,Her dress into court the other day???,./media/batch1/33/images/img0.jpeg,False,Ordinal Historian,https://x.com/demB4cap/status/1783109545268572173,2024-04-24T12:23:38,Society,Deepfakes,"This viral photo, purported to show Stormy Daniels arriving at Donald Trump's criminal trial in a mushroom-patterned dress, is digitally altered.The original shot of her in a blue dress was snapped before she appeared on ABC's 'The View' in 2018.https://factcheck.afp.com/doc.afp.com.34Q97L3",
fake_sample,batch1,34,Wall Street Silver? 🇺🇸🇺🇸🇺🇸,./media/batch1/34/images/img0.jpeg,False,Wall Street Silver,https://x.com/WallStreetSilv/status/1768577895155331501,2024-03-15 10:00:03,Society,Misattributed Images,"This meme has been circulating for months, but it does not actually depict the US border with Mexico.The photo dates to October 2015 and shows migrants at a train station near the border between Greece and North Macedonia, where it can be geolocated.",Bill McCarthy
fake_sample,batch1,35,Biden is right now in a meeting with the country's top military leadership.,./media/batch1/35/images/img0.jpeg,False,S p r i n t e r,https://x.com/SprinterFamily/status/1752095139248341194,2024-01-29 22:23:28,Politics-United-States-Presidential-Election,Deepfakes,"A fake image of Joe Biden meeting military leaders in Army fatigues went viral, claimed to show the president responding to an attack in Jordan that killed US troops.Misshapen objects, deformed hands and distorted heads are all signs it is AI-generated.",Bill McCarthy
fake_sample,batch1,36,"Under EXTREME CENSORSHIP:Leaked image of Ramat David Airbase, in Haifa, after Hezbollah bombed HELL out of it. 🔥Bahahahahah",./media/batch1/36/images/img0.jpeg,False,Jelina,https://x.com/JeezyJelly2023/status/1838390862512034085,2024-09-24 01:31:51,Politics-Warfare-Lebanon-Israel Conflict,Deepfakes,"Fake ❌After analyzing the photo, #Misbar’s team found that the image in question is an AI-generated photo. 📍 There are several distortions and unclear outlines that could be noted in the photo.Read more: https://msbr.co/0iy1m #Lebanon",Misbar
fake_sample,batch1,37,Wow. They are now openly saying the Democrats plan on stealing the election.,./media/batch1/37/images/img0.jpeg,False,Laura Loomer,https://x.com/LauraLoomer/status/1846251495810842816,2024-10-15 18:07:12,Politics-United-States-Presidential-Election,Deepfakes,❌ This is not an authentic headline from @TheAtlantic-- it was fabricated and superimposed on text from an article published in 2021 https://u.afp.com/5znc,AFP Fact Check 🔎
fake_sample,batch1,38,"📍Gatlinburg, Tennessee yesterday",./media/batch1/38/images/img0.jpeg,False,The Dibster,https://x.com/richarddibX/status/1840533653257928908,2024-09-29 23:26:33,Nature,Deepfakes,"Posts purport to show Gatlinburg, Tennessee flooded after Hurricane Helene devastated the southeastern United States. But the photo was fabricated using artificial intelligence https://u.afp.com/5R9w",AFP Fact Check 🔎
fake_sample,batch1,39,The boys in Brooklyn could only hope for this level of drip,./media/batch1/39/images/img0.jpeg,False,Nikita S,https://x.com/singareddynm/status/1639655045875507201,2023-03-25 15:46:40,Entertainment,Deepfakes,"❌ This supposed image of Pope Francis is not authentic -- it has classic signs of AI manipulation, and Vatican experts say the coat does not conform with papal wear http://u.afp.com/i89a",AFP Fact Check 🔎
fake_sample,batch1,40,I love Jennifer Aniston,./media/batch1/40/images/img0.jpeg,False,Jesus is King,https://x.com/ProseccoLiquido/status/1851735254492487718,2024-10-30 21:17:42,Politics-United-States-Presidential-Election,Deepfakes,"This image of Jennifer Aniston wearing a 'keep America Trumpless' T-shirt is doctored and has been widely debunked before. The real image was taken in Italy in 2018, and there's no anti-Trump message on her shirt.",Shayan Sardarizadeh
fake_sample,batch1,41,null,./media/batch1/41/images/img0.jpeg,False,Makhele Makhele,https://x.com/makhelee/status/1851648046494335145,2024-10-30 15:31:10,Entertainment,Deepfakes,"This photo of Keanu Reeves is edited.The original was taken at an event in Italy in 2017.This isn’t the first time the actor’s picture has been edited to make it look like he is holding a T-shirt with a message.Like this one, checked earlier by Snopes https://snopes.com/fact-check/keanu-reeves-donald-trump-t-shirt/",Olga Robinson
fake_sample,batch1,42,"🇸🇪🇺🇦🇷🇺🚨‼️ BREAKING: Swedish instructors killed!Multiple Swedish instructors were killed in the missile strike on the communication troop training center in Poltava.-> Britta Ellwanger, a foreign volunteer working with the Ukrainian Army and studying with the deceased instructor at a Swedish university confirms this.Reminder, that it was Sweden that planned to supply two ASC 890 AWACS aircraft, the training of whose onboard personnel corresponds to the profile of the training center.The missile strike on Poltava is extremely successful from the military perspective.",./media/batch1/42/images/img0.jpeg; ./media/batch1/42/images/img1.jpeg,False,Lord Bebo,https://x.com/MyLordBebo/status/1830968110188274013,2024-09-03 13:56:29,Politics-Warfare-War-in-Ukraine,De-contextualization,null,Britta Ellwanger🇺🇦
fake_sample,batch1,43,President Donald J Trump just posted this to his Truth Social 😮 🇷🇺 🇺🇸 🍷Are you trusting the plan?,./media/batch1/43/images/img0.jpeg,False,RichardStrocher,https://x.com/O_Rob1nson/status/1747523105054986745/photo/1,2024-01-17 02:55:00,Politics-other,Deepfakes,"This image of Putin and Trump is clearly AI-generated.

Just look at the stems of the glasses in their hands. 

It was originally posted on Instagram as part of a series of images of an AI-generated “date night” involving Putin and Trump. https://t.co/yVbbfepwli",Olga Robinson
fake_sample,batch1,44,Cackle Cackle!Make this photo famous.,./media/batch1/44/images/img0.jpeg,False,Real Ben Garrison Cartoons,https://x.com/Shayan86/status/1815143449516990894/photo/2,2024-07-21 18:18:00,Politics-United-States-Presidential-Election,Deepfakes,"This digitally-altered image of Kamala Harris posing alongside Jeffrey Epstein is being shared in the wake of Joe Biden's endorsement of her as the new Democratic nominee.

The real image, captured in 2015, shows Harris posing with her husband Douglas Emhoff. https://t.co/aQtYoK90Ke",Shayan Sardarizadeh
fake_sample,batch1,45,Never forget. Five dancing Israelis.,./media/batch1/45/images/img0.jpeg,False,Syrian Girl,https://x.com/Shayan86/status/1824015984786547112/photo/1,2024-08-14 23:44:00,Politics-Warfare-Israel-Palestine,De-contextualization,"Never forget. Al-Qaeda was responsible for 9/11, and this is an AI-generated image. https://t.co/4IlYm3M4mk",Shayan Sardarizadeh
fake_sample,batch1,46,"No, this isn’t a scene from a movie.This is Beirut tonight under Israeli bombs",./media/batch1/46/images/img0.jpeg,False,sarah,https://x.com/Shayan86/status/1824015984786547112/photo/2,2024-10-20 22:59:55,Politics-Warfare-Lebanon-Israel Conflict,Deepfakes,"A second image depicting Beirut airport in flames with a plane nearby is being widely shared amid intense Israeli strikes targeting Beirut tonight.

This image is also AI-generated and fake. It was shared on Instagram by a Lebanese account and labelled as AI. https://t.co/pL14J5homX",Shayan Sardarizadeh
fake_sample,batch1,47,What????,./media/batch1/47/images/img0.jpeg,False,Bing!,https://x.com/zoo_bear/status/1849149413458858364/photo/1,2024-10-23 14:49:00,Society,Deepfakes,Edited image of Kashmir Eye Hospital @tweetkeh doing rounds https://t.co/Kt26bNM4HH,Mohammed Zubair
fake_sample,batch1,48,It’s just a matter of time! ,./media/batch1/48/images/img0.jpeg,False,Cultural Maverick,https://x.com/CulturalMaverik/status/1861427950958321868,2024-11-26 15:13:01,Society,Deepfakes,The years in this AI picture are not correct. Both men would be 70 years old today.,Helpful Community Notes
fake_sample,batch1,49,MAKE THIS VIRAL! @realDonaldTrump,./media/batch1/49/images/img0.jpeg,False,Patriot4Life,https://x.com/billdmccarthy/status/1823833986835042792/photo/1,2024-08-13 21:28:02,Politics-other,Deepfakes,"Donald Trump shared a Truth Social post last week falsely claiming Kamala Harris put out a Craigslist ad seeking paid ""anti-Trump"" actors for an Arizona rally.

The fake listing is actually an altered version of an old hoax about hired ""pro-Trump"" actors.

https://t.co/gBYtwXsJ7c https://t.co/aLx03OTzGh",Bill McCarthy
fake_sample,batch1,50,Statue of Allah แปลว่า รูปปั้นอัลลอฮ ที่อยู่ภายในกระแส#แทนการสรรเสริญอิสลาม ก็มีแค่นี้แหละ !!#รวมพลังคนไทยพุทธ 6 พ.ค. 67,./media/batch1/50/images/img0.jpeg,False,รวมพลังคนไทยพุทธ ภาคอีสาน,https://x.com/AFPFactCheck/status/1802579142166339615/photo/1,2024-05-06 21:28:02,Society,Deepfakes,"Don't be fooled by Facebook posts about an 'Allah statue' at Islam's holiest site the Kaaba 

The posts share an edited photo and Islam prohibits images or statues of Allah

https://t.co/7WXg8cZ3t7 https://t.co/LJKpKyDEhJ",AFP Fact Check 🔎
fake_sample,batch1,51,Tee link:  Well said Taylor. Nope - no more trump 💙 love this tee,./media/batch1/51/images/img0.jpeg,False,null,https://x.com/billdmccarthy/status/1748441308392206373/photo/1,2024-1-15 03:18:02,Politics-United-States-Presidential-Election,Deepfakes,"This image purporting to show Taylor Swift wearing an anti-Donald Trump T-shirt has been shared in dozens of Facebook posts advertising the same merchandise.

The photo is doctored; the original headshot comes from a 2019 gala where she wore a pink dress.

https://t.co/WNquVkSIg6 https://t.co/YOG5zPOGxV",Bill McCarthy
