sample_type,batch_file,tweet_id,text,images,label,author,post_url,date_posted,topic,error_category,flagging_tweet_text,flagging_tweet_authors
fake_sample,batch6,74,"🔥🚨BREAKING: I want to thank Elon Musk and X for monetizing my account again and giving me 3 months of backpay. Although the Muslims took my pay away Elon Musk and Linda Yaccarino personally reinstated my pay. This man is a hero, he is a true champion of Free Speech. 

To X, ",./media/batch6/74/images/img0.jpeg,False,Dom Lucre | Breaker of Narratives,https://x.com/dom_lucre/status/1781731086990557632,2024-04-20 17:06:08,Society,Incorrectly Captioned Images,"$70k to someone who posted child sexual abuse material. 

We agree on one thing, I too think X's advertisers ought to be aware of this. https://t.co/wcbQdcZz4O",Elise Thomas
fake_sample,batch6,75,Today is my birthday and I'm disabled  can i get 1 follow me happy birthday wishes.,./media/batch6/75/images/img0.jpeg; ./media/batch6/75/images/img1.jpeg; ./media/batch6/75/images/img2.jpeg; ./media/batch6/75/images/img3.jpeg,False,Sarah Khan,null,2024-04-21 20:43:56,Society,Misattributed Images,"Notice a pattern? These images are either AI-generated or stolen, posted to appeal to your sense of empathy for engagement and a follow. 

Once that's been achieved, the hope is you will buy this account's artwork, all of which is either fake or stolen from real artists. https://t.co/3sWySUw5tJ",Shayan Sardarizadeh
fake_sample,batch6,76,"#Breaking: The commander of the #French mercenary group “Les Commandos,” who fought in #Gaza for a monthly salary of €15,000 paid by #Israel, has been killed along with five of his unit in a booby-trapped tunnel in Gaza. #GazaConflict #france",./media/batch6/76/images/img0.jpeg,False,SilencedSirs◼️,https://x.com/SilentlySirs/status/1781610099015909513,2024-04-20 09:05:22,Politics-Warfare-Israel-Palestine,Misattributed Images,"This image, viewed half a million times, falsely claims to show the commander of a ""French mercenary group"" - paid by Israel - who's been killed along with his unit in Gaza.

But the image, taken in 2013, shows Israeli soldiers taking part in an exercise in the Golan Heights. https://t.co/fJP4Oa5uOq",Shayan Sardarizadeh
fake_sample,batch6,77,@SecretaryPete You went on a 3 month maternity leave during the worst supply chain disaster in the history of America. ,./media/batch6/77/images/img0.jpeg,False,Vince Langman,https://x.com/LangmanVince/status/1857425801412841570,2024-11-15 14:09:55,Politics-other,Deepfakes,This photo is NOT Pete Butigeige. It is a digitally altered photo. The original photo is linked here:,Helpful Community Notes
fake_sample,batch6,78,"Ермак заплатил 27 млн долларов, чтобы попасть в топ-100 от Time.

Bellingcat раскопали информацию о том, кто заплатил, чтобы Time внесли их в топ-100 самых влиятельных людей. Среди прочих оказался и Андрей Ермак. Средний чек за такое место от 10 до 30 млн долларов, Ермаку это ",./media/batch6/78/images/img0.jpeg; ./media/batch6/78/images/img1.jpeg,False,Чайка,https://x.com/ice_gull1/status/1781636177633931736,2024-04-20 10:49:00,Politics-other,De-contextualization,"A mass fake-news campaign with forged ""BBC"" videos has been launched claiming falsely that @bellingcat has found that Andrey Yermak paid for being included in the @TIME list of influential people. Interestingly, the campaign also tries to discredit @yulia_navalnaya appearing on https://t.co/YAKZJYo0Gd",Christo Grozev
fake_sample,batch6,79,"🚨 BREAKING: Israel appears to have attacked Esfahan, Iran.

This video was posted by the IRGC. ",./media/batch6/79/images/img0.jpeg,False,Holly Dagres,https://x.com/hdagres/status/1781134730341089689,2024-04-19 01:36:26,Politics-Warfare-Middle-East-Conflict,Incorrectly Captioned Images,"Geolocated this footage, shows activity in the sky to the east of the city. 

Flagpole visible is here: https://t.co/ObQ62Yt9qq

Was filmed from a building over the road from Laleh Park. https://t.co/04LwqQAgya",Sam Doak
fake_sample,batch6,80,"IRANIAN PRESIDENT CLAIMS VICTORY AFTER ISRAELI ATTACK. We are fighting a war of wills, and Iran has won and will continue to achieve victories. 'The True Promise' reflected our strength, the iron will of our people, and our unity. All segments of the people and all... Show more",./media/batch6/80/images/img0.jpeg,False,Mario Nawfal,https://x.com/Shayan86/status/1781312656999112790/photo/1,2024-04-19 09:23:26,Politics-Warfare-Middle-East-Conflict,Misattributed Images,"The image on the right shows Hassan Rouhani, who hasn't been the president of Iran since 2021. https://t.co/6sV6hvCLH4",Shayan Sardarizadeh
fake_sample,batch6,81,BREAKING: ISRAEL ARMY BOMBED AREAS NEAR ISFAHAN AND NATANZ WHICH CONTAINS IMPORTANT FACILITIES OF IRAN'S NUCLEAR PROGRAM,./media/batch6/81/images/img0.jpeg,False,Ghoncheh Habibiazad | غنچه,https://x.com/GhonchehAzad/status/1781221237613531244,2024-04-19 06:25:36,Politics-Warfare-Middle-East-Conflict,Incorrectly Captioned Images,"This video has been shared widely today, claiming to show the aftermath of an apparent retaliatory strike by Israel on Isfahan, Iran. But the video is old and unrelated to the events today.",Shayan Sardarizadeh
fake_sample,batch6,82,"🚨BREAKING: Israel has responded and is currently attacking Iran inside Iran as well as Syria and Iraq.

Baghdad / Babylon in Iraq, 
Isfahan in Iran, and Suwayda in Syria.

ABC News

 ",./media/batch6/82/images/img0.jpeg,False,AJ Huber,https://x.com/Huberton/status/1781149118229860425,2024-04-19 02:33:36,Politics-Warfare-Middle-East-Conflict,De-contextualization,"This video, viewed over 400,000 times, claims to show footage of an alleged retaliatory attack by Israel in Isfahan, Iran, today.

But the same video was posted yesterday, claiming to show missiles fired from Lebanon landing in northern Israel. https://t.co/BfHh3WkkM1",Shayan Sardarizadeh
fake_sample,batch6,83,Biden humiliated with back-corner spot in APEC family photo as China’s Xi get place of honor in front row  ,./media/batch6/83/images/img0.jpeg,False,New York Post,https://x.com/nypost/status/1857844976840765936,2024-11-16 17:55:34,Politics-other,De-contextualization,"The Heads of State are standing in alphabetical order, with China towards the front of the alphabet and United States right before Vietnam at the end. ",Helpful Community Notes
fake_sample,batch6,84,WW3 ALERT ISRAEL JUST LAUNCHED A MASSIVE ATTACK ON IRAN AND IS RUMORED TO HAVE HIT CRITCAL NUCLEAR FACILITIES WHICH COULD CAUSE RADIATION TO LEAK OUT INTO THE WORLD !,./media/batch6/84/images/img0.jpeg,False,Matt Wallace,https://x.com/Shayan86/status/1781161371821854788/photo/1,2024-04-19 02:22:18,Politics-Warfare-Middle-East-Conflict,De-contextualization,"This guy is the absolute worst, and it says a lot that he's become one of the biggest influencers on this platform by posting utter garbage like this all the time. https://t.co/7D4TY6pH0X",Shayan Sardarizadeh
fake_sample,batch6,85,! IRAN AND ISRAEL ARE NOW IN A FULL BLOWN WAR AND WE COULD BE ABOUT TO SEE A GLOBAL NUCLEAR HOLOCAUST WW3 WILL BE THE MOST TERRIFYING THING HUMANITY HAS EVER EXPERIENCED PREPARE FAST THIS FOOTAGE IS ABSOLUTELY INSANE!!!,./media/batch6/85/images/img0.jpeg,False,Matt Wallace,https://x.com/Shayan86/status/1781161371821854788/photo/2,2024-04-19 02:56:18,Politics-Warfare-Middle-East-Conflict,De-contextualization,"This guy is the absolute worst, and it says a lot that he's become one of the biggest influencers on this platform by posting utter garbage like this all the time. https://t.co/7D4TY6pH0X",Shayan Sardarizadeh
fake_sample,batch6,86,a crypto live streamer just got hacked and lost $100k live ,./media/batch6/86/images/img0.jpeg,False,Pasta 🍝,https://x.com/pastagotsauce/status/1857639294854377558,2024-11-16 04:18:15,Society,Incorrectly Captioned Images,The streamer did not lose money. The seed phrase from the stream is fake and comes up invalid thus meaning it is not linked to the streamer’s crypto wallet.,Helpful Community Notes
fake_sample,batch6,87,Ayatollah Ali Khamenei is featured on the cover of Forbes magazine with the caption. The Most Powerful Man in the World .,./media/batch6/87/images/img0.jpeg,False,S p r i n t e r,https://x.com/ArsenKeklikoglu/status/1780974112287973827/photo/1,2024-04-18 14:38:11,Politics-other,Incorrectly Captioned Images,"Your daily 'Sprinter' fake.

❌ This is a fabricated cover of the FORBES magazine, purportedly featuring 🇮🇷 Khamenei.

The @Forbes magazine has never published such a cover. See https://t.co/GqEyZn9mwS

@Shayan86 @DavidPuente @ArbiterOfTweets @billdmccarthy @LGalrao https://t.co/iZ1Z2nV0Rx | This supposed Forbes issue honoring Ayatollah Ali Khamenei as ""the most powerful man"" is fake.

It is ""not a real Forbes cover and was never published on any of our platforms,"" a Forbes spokesperson said. And it uses an old photo of Iran's supreme leader.

https://t.co/rkwrXGidKm https://t.co/lpyZmk7jxP",Arsenios Keklikoğlu 🇬🇷; Bill McCarthy
fake_sample,batch6,88,"Did Columbia students use dummies of paragliders as decor in their Gaza solidarity camp? 
If you don’t know, some Hamas terrorists reportedly used paragliders to fly over fence and commit Oct 7 massacre that killed 1200 Israelis.
What next? A giant mural of Hamas chief Sinwar, ",./media/batch6/88/images/img0.jpeg,False,Hussain Abdul-Hussain,https://x.com/hahussain/status/1780642512714993675,2024-04-17 17:00:32,Politics-Warfare-Israel-Palestine,Incorrectly Captioned Images,@hahussain That's a doctored image. Those are clearly parachute emojis added to the original image. Neither of those two parachutes can be found in other images of the same protest published by news outlets. https://t.co/2DKc2YUSyZ,Shayan Sardarizadeh
fake_sample,batch6,89,🇯🇴 Air defense over Jordan trying to intercept Iranian drones. ,./media/batch6/89/images/img0.jpeg,False,DD Geopolitics,https://x.com/DD_Geopolitics/status/1779260949461074156,2024-04-13 21:30:42,Politics-Warfare-Israel-Palestine,Incorrectly Captioned Images,"Another fake by Sprinter and Donbas Devushka.

This image has been taken from Motaz Akef Arabiat  https://t.co/yMNwF07SjK and shows flare bombs used over Palestinian towns in West Bank by Israeli forces reportedly in search of a 14 yo person.

Initial fact check by @misbar_en 🧵 https://t.co/bfHlBNfGxh",Arsenios Keklikoğlu 🇬🇷
fake_sample,batch6,90,"A river in Hormuz, Iran turned red like the biblical plague that turned the Nile River to blood. 

….In case you were wondering whose side God is on. 
",./media/batch6/90/images/img0.jpeg,False,Aviva Klompas,https://x.com/AvivaKlompas/status/1780338706953449744,2024-04-16 20:53:19,Nature,De-contextualization,"That's the red beach of Hormuz Island, a famous tourist attraction in the Persian Gulf, and it hasn't suddenly turned red because of Israel-Iran tensions, biblical plagues, God's wrath or Passover. 

It's always been red because of red oxide in the soil. https://t.co/xSs1tOUH1W",Shayan Sardarizadeh
fake_sample,batch6,91,"why do we have 30 military bases surrounding Iran?

Iran isn't a threat to America but America is a threat to Iran 🇮🇷 ",./media/batch6/91/images/img0.jpeg,False,Jake Shields,https://x.com/jakeshieldsajj/status/1779468277565317392,2024-04-14 11:14:32,Politics-Warfare-Middle-East-Conflict,Misattributed Images,"The US does not have military bases in Pakistan, Afghanistan or Turkmenistan, Jake. https://t.co/kPmuqI4kXF",Shayan Sardarizadeh
fake_sample,batch6,92,ISRAELIS in FULL PANIC as IRANIAN missiles land in ISRAEL.,./media/batch6/92/images/img0.jpeg,False,Jackson Hinkle,https://x.com/Shayan86/status/1779372922596958687/photo/1,2024-04-14 12:21:00,Politics-Warfare-Israel-Palestine,Incorrectly Captioned Images,"This video, posted by Jackson Hinkle and others and viewed nearly 5 million times, claims to show ""Israelis panicking"" as Iran's missiles and drones reach Israel.

in fact, it shows Louis Tomlinson fans near Four Seasons Hotel in Buenos Aires, Argentina last week; verified by https://t.co/11tX9bL0sh",Shayan Sardarizadeh
fake_sample,batch6,93,"This can’t be the noodles I am eating 😭
 ",https://pbs.twimg.com/ext_tw_video_thumb/1834488186153668608/pu/img/jUz5LluXzzks-BTv.jpg,False,Interesting STEM,https://x.com/InterestingSTEM/status/1857681379015671941,2024-11-16 07:05:29,Society,Incorrectly Captioned Images,These are not noodles. This is a basic production of soap or beauty soap. The author is lying to get views and attention.,Helpful Community Notes
fake_sample,batch6,94,Lets go! Israeli settlement hit! Eat shit racist!,./media/batch6/94/images/img0.jpeg,False,Ryan Dawson,https://x.com/RyLiberty/status/1779291530169098681,2024-04-13 23:32:13,Politics-Warfare-Israel-Palestine,De-contextualization,"This video, widely shared last night, falsely claims to show an Israeli settlement struck by Iranian missiles.

The video dates back to the Israel-Hamas war in May 2021, showing a Hamas rocket destory a house in Rishon LeZion. https://t.co/CDVkyE7JEw",Shayan Sardarizadeh
fake_sample,batch6,95,⚠️ 𝐁𝐫𝐞𝐚𝐤𝐢𝐧𝐠 𝐍𝐞𝐰𝐬 ⚠️ 🇮🇷| 𝗧𝗵𝗲 𝗦𝗵𝗮𝗵𝗲𝗱 𝗗𝗿𝗼𝗻𝗲𝘀 𝗮𝗽𝗽𝗲𝗮𝗿 𝘁𝗼 𝗵𝗮𝘃𝗲 𝗿𝗲𝗮𝗰𝗵𝗲𝗱 𝗜𝘀𝗿𝗮𝗲𝗹 𝗿𝗶𝗴𝗵𝘁 𝗻𝗼𝘄 Video confirmation has been provided: ,./media/batch6/95/images/img0.jpeg,False,Iran Spectator,https://x.com/IranSpec/status/1779266254089736388,2024-04-14 05:21:13,Politics-Warfare-Israel-Palestine,De-contextualization,Whoever provided you with video confirmation should be fired because this footage is from October 2023. https://t.co/V3CW5kmMQa,Tal Hagin
fake_sample,batch6,96,Iran's missiles launching on full speed against Israel! Finally! #Israel #Iran #Iranians ,./media/batch6/96/images/img0.jpeg,False,SAIHYA,https://x.com/Saihya_/status/1779291904750063650,2024-04-13 23:33:42,Politics-Warfare-Middle-East-Conflict,Misattributed Images,"This video, viewed nearly 700,000 times, falsely claims to show the launch of Iranian missiles against Israel last night.

But the video is from 2020, and shows rockets fired by the Turkish military in Syria. https://t.co/FYuSAS5QLO",Shayan Sardarizadeh
fake_sample,batch6,97,Tel Aviv airport...save who can...,./media/batch6/97/images/img0.jpeg,False,Long Fa,https://x.com/ArsenKeklikoglu/status/1779298109983433215/photo/1,2024-04-13 11:52:00,Politics-other,Incorrectly Captioned Images,"NOT a video from Tel Aviv airport tonight.

This is Paris Metro, 2019
@Shayan86
@talhagin @alexcapron @DavidPuente https://t.co/NmYi87l0lW",Arsenios Keklikoğlu 🇬🇷
fake_sample,batch6,98,Hell on Earth as Fires continue to Follow 4 burn out of control. Reports suggest that over 80% of ALL of TexasCattle Feed in the impacted area !!!,./media/batch6/98/images/img0.jpeg,False,Ghoncheh Habibiazad | غنچه,https://x.com/GhonchehAzad/status/1779307601295036862,2024-04-13 19:58:00,Nature,Misattributed Images,"Iran's state TV has been continuously running this video tonight as evidence of its missiles making impact on the ground and hitting targets in Israel. 

But it's old footage of farm fire in Texas and completely unrelated to tonight's attack.",Shayan Sardarizadeh
fake_sample,batch6,99,How would you like to be on this flight? ,./media/batch6/99/images/img0.jpeg,False,A Man Of Memes,https://x.com/RickyDoggin/status/1861458288879268188,2024-11-26 17:13:34,Entertainment,Incorrectly Captioned Images,"This is not a real scenario, this is just an edit from a video game like Microsoft Flight Simulator or X-Plane. You can tell by the physics of the surroundings.The simulators nowadays got better 4k graphics and ultra-realistic texture and details. ",Helpful Community Notes
fake_sample,batch6,100,Israelis' reality in the last hours:,./media/batch6/100/images/img0.jpeg,False,Israel Defense Forces,https://x.com/Shayan86/status/1779317154539536730/photo/1,2024-04-14 01:27:18,Politics-Warfare-Middle-East-Conflict,Incorrectly Captioned Images,"The IDF has just posted this video compilation showing some clips of Iran's retaliatory drone and missile attack against it.

While most of the clips are indeed from tonight, this one at the end is an old clip of a Russian Grad rocket launcher from nearly 10 years ago. https://t.co/Twh4xxLWlF",Shayan Sardarizadeh
fake_sample,batch7,1,"3 reasons why NASA Stopped Exploring The Ocean. This will shock you🤯😳

A thread👇🏾 ",./media/batch7/1/images/img0.jpeg; ./media/batch7/1/images/img1.jpeg,False,MERITTEQUILA OF OSUN,https://x.com/MeritTequila/status/1856929369899323434,2024-11-14 05:17:16,Science,De-contextualization,"NASA explores both space and the ocean. While their primary focus is on space, they also conduct ocean research to understand Earth's climate and ecosystems. Claims that NASA 'stopped' ocean exploration due to mysterious discoveries are false.",Helpful Community Notes
fake_sample,batch7,2,"This $20 hooker, failed her GED exam 3 times, is the new Secretary of Education. This is what you voted for. ",./media/batch7/2/images/img0.jpeg,False,Jules Morgan 🧸,https://x.com/glamelegance/status/1856842319028507075,2024-11-13 23:31:21,Politics-other,Incorrectly Captioned Images,This is false. Lauren Boebert has not been appointed Secretary of Education.,Helpful Community Notes
fake_sample,batch7,3,"Quaker Oats responds to backlash, bringing back Aunt Jemima! “Aunt Jemima is back!” ",./media/batch7/3/images/img0.jpeg,False,Uncensored USA 🇺🇸,https://x.com/CarlosSimancas/status/1855242733985697868,2024-11-10 06:29:38,Society,De-contextualization,This rumor originated on the Satirical News Website 'The Dunning-Kruger Times':,Helpful Community Notes
fake_sample,batch7,4,AINT NO PARTY LIKE A DIDDY PARTY 😭😭😭 ,./media/batch7/4/images/img0.jpeg,False,Everything Out Of Context,https://x.com/EverythingOOC/status/1853055425114931203,2024-11-03 12:43:36,Entertainment,Misattributed Images,Nintendo of America did not post this.,Helpful Community Notes
fake_sample,batch7,5,Best Pop Vocal Album‘s nominees and their metascore on Metacritic: ,./media/batch7/5/images/img0.jpeg,False,☀️,https://x.com/NOTR0CKWELL/status/1854950273178837391,2024-11-08 18:13:03,Entertainment,Incorrectly Captioned Images,"The standard edition of 'The Tortured Poets Department' has a score of 76 on Metacritic.'The Anthology' deluxe edition of the album has a score of 69, but is not the version that was submitted for GRAMMYs consideration. Including this score instead is misleading.",Helpful Community Notes
fake_sample,batch7,6,Ariana Grande has unfollowed The Recording Academy on Instagram. ,./media/batch7/6/images/img0.jpeg; ./media/batch7/6/images/img1.jpeg,False,Pop Flop,https://x.com/PopFlopHQ/status/1855027629704851486,2024-11-08 23:20:26,Entertainment,Incorrectly Captioned Images,Ariana never followed The Recording Academy.,Helpful Community Notes
fake_sample,batch7,7,“EUPHORIA” is rumored to be canceled. ,./media/batch7/7/images/img0.jpeg,False,Pop Tingz,https://x.com/ThePopTingz/status/1855003059539075269,2024-11-08 21:42:48,Entertainment,De-contextualization,HBO has already explained that these rumors are false and that production of season 3 of Euphoria is under way. This post is misleading and probably engagement farming.,Helpful Community Notes
fake_sample,batch7,8,"Kurt Russell just said: ""It is now proven, beyond a shadow of a doubt that Kamala Harris and Joe Biden CHEATED in the 2020 election with mail-in ballots."" 
What do you think? ",./media/batch7/8/images/img0.jpeg,False,Johnny Midnight ⚡️,https://x.com/its_The_Dr/status/1854903442327978393,2024-11-08 15:06:57,Politics-United-States-Presidential-Election,Incorrectly Captioned Images,Kurt Russell never made this statement.,Helpful Community Notes
fake_sample,batch7,9,"BREAKING 🚨
TOM HANKS HAS LEFT THE UNITED STATES OF AMERICA

""Dear friends and fans,
It is with a heavy heart and an even heavier suitcase that I announce: I have officially fled the country. Yes, you heard that right-I am currently writing this from a far-off, undisclosed ",./media/batch7/9/images/img0.jpeg,False,SANTINO,https://x.com/MichaelSCollura/status/1854932223411236882,2024-11-08 17:01:19,Entertainment,Incorrectly Captioned Images,This is a made up story by a TikTok user,Helpful Community Notes
fake_sample,batch7,10,Banksy: ,./media/batch7/10/images/img0.jpeg,False,"𝗧𝗼𝗺 𝗢𝘀𝗯𝗼𝗿𝗻 PhD, FRSA, Ahem!",https://x.com/call_me_tomasso/status/1854673348263133315,2024-11-07 23:52:39,Entertainment,Misattributed Images,This is not artwork from Banksy. It is from an artist known as 'my_stencil'.A link to an interview with the artist about this particular artwork is provided below.,Helpful Community Notes
fake_sample,batch7,11,CHILD KILLERS,./media/batch7/11/images/img0.jpeg,False,Sulaiman Ahmed,https://x.com/Shayan86/status/1743298633074638940/photo/1,2024-01-05 07:30:00,Politics-Warfare-Middle-East-Conflict,Misattributed Images,"This image, claiming to show a row of Palestinian children's bodies, is unrelated to the current Israel-Hamas war.

The graphic photo was taken in 2013 after the Ghouta chemical attack by the Syrian government, which resulted in hundreds of deaths, including children. https://t.co/AnTNDy4CYC",Shayan Sardarizadeh
fake_sample,batch7,12,In russia continuano i festeggiamenti per l'elezione di Putin.,./media/batch7/12/images/img0.jpeg,False,Anti-dumb - nazicommie hunter. 🇺🇦🇮🇹🇪🇺🌎,https://twitter.com/GufoPuso/status/17706964607339194721,2024-03-21 06:18:00,Politics-other,Misattributed Images,"This video has nothing to do with Russia or recent Ukrainian attack.

It was posted online by Chinese media back in 2017 regarding a fire in Dalian petrochemical refinery.

https://t.co/qF1vqA2m55

Context https://t.co/5cOoNDOG7g https://t.co/MHUg86pp28",Arsenios Keklikoğlu 🇬🇷
fake_sample,batch7,13,Rare 'behind the scenes' footage of a Pallywood production,./media/batch7/13/images/img0.jpeg,False,Hamas Atrocities,https://twitter.com/GufoPuso/status/17706964607339194721,2024-03-15 09:50:00,Politics-other,De-contextualization,"This post claims to show a ""Pallywood production"" of Gazans staging footage of casualties and destruction for cameras.

In fact, it's behind-the-scenes footage of a pro-Palestinian song released as an ad for Ramadan by Palestinian telecoms company Jawwal, based in Ramallah. https://t.co/JsdTBXS7qK",Shayan Sardarizadeh
fake_sample,batch7,14,"Belgorod, Russian now.  Russian authorities continue to say that 'everything is under control' and that 'there is no panic.' Yep, seems like a perfectly normal day in Russia. Belgorod residents always took such joy in seeing attacks on Ukraine much now?",./media/batch7/14/images/img0.jpeg,False,Jason Jay Smart,https://x.com/Shayan86/status/1768311727781757425/photo/1,2024-03-14 15:22:24,Politics-Warfare-War-in-Ukraine,Misattributed Images,"This video is going viral with claims that it shows vehicles on fire on a road in the Russian city of Belgorod today.

The clip is actually from January 2022, filmed during anti-government protests in Almaty, Kazakhstan. https://t.co/nI9kCiJQ1S",Shayan Sardarizadeh
fake_sample,batch7,15,"If the Nova festival wasn’t a staged military operation used to justify a genocidal military response on Palestinians, someone should be able to answer basic questions like this. 

What is the location of the field these people are running in?  

The festival was reportedly held ",./media/batch7/15/images/img0.jpeg,False,Morgan,https://x.com/Chase00M/status/1767382382829514927,2024-03-12 02:49:31,Politics-Warfare-Israel-Palestine,De-contextualization,"GeoConfirmed ISR-PAL.

The spreading of misinformation through insinuations is also a well-known tactic. Questions are posed with insinuations in order to sow confusion because the answer is not known. In this case, the hidden insinuation is that it could be a military staged https://t.co/CuEXCBX1eY",GeoConfirmed
fake_sample,batch7,16,Pallywood Pictures presents a new short film. Actors include dolls purchased from Aliexpress.You can find more information and ways to use such dolls by googling 'reborn baby'.,./media/batch7/16/images/img0.jpeg,False,Olia,https://x.com/Chase00M/status/1767382382829514927,2024-03-03 19:43:00,Politics-Warfare-Israel-Palestine,Incorrectly Captioned Images,"This tweet falsely claims to show a Gazan woman holding two fake baby dolls pretending like they're dead.The woman is Rania Abu Anza, 29, and those are her real five-month-old twin babies Naeim and Wissam, both of whom, along with her husband, were killed in Rafah on Saturday.",Shayan Sardarizadeh
fake_sample,batch7,17,حزب الله يستهدف المنطقة الصناعية في 'دانون بركة' قرب عكا للمرة الأولى بعمق 16 كيلومتراً وأنباء عن سقوط قتلى وجرحى,./media/batch7/17/images/img0.jpeg,False,Arab-Military,https://x.com/ashrafnsier/status/1762512955617247734,2024-02-28 12:20:00,Politics-Warfare-Lebanon-Israel Conflict,Misattributed Images,Honestly amazed that this video (and others) from Hebron have falsely been attributed to strikes in Northern Israel by Hezbollah by numerous major accounts over the past 24 hours - Despite local Palestinian channels correctly covering it as a fire in Hebron from the beginning. https://t.co/SgjJx63chh,Tal Hagin
